number,value,datetime_start,datetime_complete,duration,params_bootstrap,params_class_weight,params_criterion,params_max_depth,params_max_features,params_min_samples_leaf,params_min_samples_split,params_n_estimators,state
0,0.8114682132786465,2025-09-18 17:25:50.491203,2025-09-18 17:25:55.035687,0 days 00:00:04.544484,True,,gini,16.0,log2,9,35,645,COMPLETE
1,0.857719174570623,2025-09-18 17:25:55.058532,2025-09-18 17:25:58.437629,0 days 00:00:03.379097,False,balanced,gini,24.0,1.0,9,40,485,COMPLETE
2,0.8032043065880543,2025-09-18 17:25:58.457936,2025-09-18 17:26:09.123284,0 days 00:00:10.665348,True,balanced,entropy,16.0,log2,11,43,1629,COMPLETE
3,0.8458023583696488,2025-09-18 17:26:09.143614,2025-09-18 17:26:22.858969,0 days 00:00:13.715355,True,,gini,16.0,1.0,18,42,1927,COMPLETE
4,0.8410119200205075,2025-09-18 17:26:22.878940,2025-09-18 17:26:27.044941,0 days 00:00:04.166001,False,,entropy,,sqrt,5,37,799,COMPLETE
5,0.8199019482184056,2025-09-18 17:26:27.065069,2025-09-18 17:26:39.381350,0 days 00:00:12.316281,True,,entropy,8.0,log2,8,20,1872,PRUNED
6,0.8073923352986412,2025-09-18 17:26:39.400213,2025-09-18 17:26:48.280534,0 days 00:00:08.880321,True,,gini,32.0,sqrt,20,17,1334,COMPLETE
7,0.812852473724686,2025-09-18 17:26:48.301367,2025-09-18 17:26:59.629840,0 days 00:00:11.328473,True,,entropy,16.0,log2,14,36,1729,PRUNED
8,0.8578249166880287,2025-09-18 17:26:59.649195,2025-09-18 17:27:10.789535,0 days 00:00:11.140340,True,,entropy,16.0,0.8,3,35,1529,COMPLETE
9,0.8341707254550116,2025-09-18 17:27:10.810660,2025-09-18 17:27:13.508143,0 days 00:00:02.697483,True,,entropy,12.0,sqrt,1,42,369,COMPLETE
10,0.8761054857728787,2025-09-18 17:27:13.528263,2025-09-18 17:27:21.571785,0 days 00:00:08.043522,False,balanced,entropy,12.0,0.8,1,6,1150,COMPLETE
11,0.8764803896436811,2025-09-18 17:27:21.592773,2025-09-18 17:27:29.197354,0 days 00:00:07.604581,False,balanced,entropy,12.0,0.8,1,5,1106,COMPLETE
12,0.8774769289925661,2025-09-18 17:27:29.218608,2025-09-18 17:27:36.609877,0 days 00:00:07.391269,False,balanced,entropy,12.0,0.8,1,2,1053,COMPLETE
13,0.8673673417072545,2025-09-18 17:27:36.631419,2025-09-18 17:27:42.667453,0 days 00:00:06.036034,False,balanced,entropy,12.0,0.5,6,2,971,COMPLETE
14,0.871987951807229,2025-09-18 17:27:42.687662,2025-09-18 17:27:50.486247,0 days 00:00:07.798585,False,balanced,entropy,12.0,0.8,5,11,1185,COMPLETE
15,0.872885157651884,2025-09-18 17:27:50.506738,2025-09-18 17:27:56.769039,0 days 00:00:06.262301,False,balanced,entropy,12.0,0.8,3,12,916,COMPLETE
16,0.8581261215073057,2025-09-18 17:27:56.788944,2025-09-18 17:28:05.856552,0 days 00:00:09.067608,False,balanced,entropy,,0.8,14,27,1403,COMPLETE
17,0.8524929505255061,2025-09-18 17:28:05.877713,2025-09-18 17:28:10.526542,0 days 00:00:04.648829,False,balanced,entropy,8.0,0.5,3,3,720,COMPLETE
18,0.858667649320687,2025-09-18 17:28:10.547944,2025-09-18 17:28:17.443213,0 days 00:00:06.895269,False,balanced,gini,32.0,0.8,1,50,1031,COMPLETE
19,0.8690047423737504,2025-09-18 17:28:17.465299,2025-09-18 17:28:19.187346,0 days 00:00:01.722047,False,balanced,entropy,24.0,0.8,7,9,200,COMPLETE
20,0.8601512432709562,2025-09-18 17:28:19.207607,2025-09-18 17:28:27.514561,0 days 00:00:08.306954,False,balanced,entropy,12.0,0.8,12,25,1288,COMPLETE
21,0.8760830556267625,2025-09-18 17:28:27.536497,2025-09-18 17:28:35.523893,0 days 00:00:07.987396,False,balanced,entropy,12.0,0.8,1,6,1167,COMPLETE
22,0.8706613688797743,2025-09-18 17:28:35.545450,2025-09-18 17:28:42.855192,0 days 00:00:07.309742,False,balanced,entropy,12.0,0.8,3,15,1090,COMPLETE
23,0.8728819533452962,2025-09-18 17:28:42.876210,2025-09-18 17:28:48.888925,0 days 00:00:06.012715,False,balanced,entropy,12.0,0.8,4,6,866,COMPLETE
24,0.8767335298641374,2025-09-18 17:28:48.909711,2025-09-18 17:28:57.928500,0 days 00:00:09.018789,False,balanced,entropy,12.0,1.0,1,6,1235,COMPLETE
25,0.8769289925660088,2025-09-18 17:28:57.950432,2025-09-18 17:29:08.449162,0 days 00:00:10.498730,False,balanced,entropy,12.0,1.0,2,2,1470,COMPLETE
26,0.8709914124583442,2025-09-18 17:29:08.470318,2025-09-18 17:29:18.426341,0 days 00:00:09.956023,False,balanced,gini,12.0,1.0,6,9,1498,COMPLETE
27,0.8787330171750833,2025-09-18 17:29:18.448612,2025-09-18 17:29:31.334784,0 days 00:00:12.886172,False,balanced,entropy,,1.0,4,2,1784,COMPLETE
28,0.8788259420661368,2025-09-18 17:29:31.356596,2025-09-18 17:29:43.398500,0 days 00:00:12.041904,False,balanced,entropy,,1.0,4,2,1674,COMPLETE
29,0.8615194821840554,2025-09-18 17:29:43.422791,2025-09-18 17:29:55.064331,0 days 00:00:11.641540,False,balanced,gini,,1.0,9,30,1757,COMPLETE
30,0.8704402717251988,2025-09-18 17:29:55.085563,2025-09-18 17:30:08.319529,0 days 00:00:13.233966,False,balanced,entropy,,1.0,5,20,1964,COMPLETE
31,0.880299923096642,2025-09-18 17:30:08.340654,2025-09-18 17:30:20.995373,0 days 00:00:12.654719,False,balanced,entropy,,1.0,3,2,1736,COMPLETE
32,0.8779351448346577,2025-09-18 17:30:21.016920,2025-09-18 17:30:33.151971,0 days 00:00:12.135051,False,balanced,entropy,,1.0,4,10,1745,COMPLETE
33,0.8719302742886439,2025-09-18 17:30:33.173422,2025-09-18 17:30:44.283555,0 days 00:00:11.110133,False,balanced,entropy,,1.0,7,10,1665,COMPLETE
34,0.866341963599077,2025-09-18 17:30:44.305502,2025-09-18 17:30:56.242848,0 days 00:00:11.937346,False,balanced,gini,,1.0,9,16,1809,COMPLETE
35,0.8755799794924378,2025-09-18 17:30:56.265067,2025-09-18 17:31:07.614007,0 days 00:00:11.348940,False,balanced,entropy,,1.0,4,14,1628,COMPLETE
36,0.8787266085619073,2025-09-18 17:31:07.637546,2025-09-18 17:31:20.685111,0 days 00:00:13.047565,False,balanced,entropy,,1.0,4,8,1875,COMPLETE
37,0.865387080235837,2025-09-18 17:31:20.707363,2025-09-18 17:31:35.402434,0 days 00:00:14.695071,True,balanced,entropy,,1.0,11,4,1988,PRUNED
38,0.8714976928992566,2025-09-18 17:31:35.423188,2025-09-18 17:31:47.726341,0 days 00:00:12.303153,False,,gini,,1.0,7,8,1873,COMPLETE
39,0.8356190720328122,2025-09-18 17:31:47.747600,2025-09-18 17:31:58.541410,0 days 00:00:10.793810,True,balanced,entropy,24.0,log2,6,19,1599,PRUNED
40,0.8706036913611894,2025-09-18 17:31:58.561262,2025-09-18 17:32:10.694359,0 days 00:00:12.133097,False,,entropy,,1.0,8,13,1845,COMPLETE
41,0.878774673160728,2025-09-18 17:32:10.715748,2025-09-18 17:32:23.192974,0 days 00:00:12.477226,False,balanced,entropy,,1.0,4,8,1777,COMPLETE
42,0.8787778774673161,2025-09-18 17:32:23.214000,2025-09-18 17:32:36.448014,0 days 00:00:13.234014,False,balanced,entropy,,1.0,4,7,1897,COMPLETE
43,0.8727217380158934,2025-09-18 17:32:36.469715,2025-09-18 17:32:46.340384,0 days 00:00:09.870669,False,balanced,entropy,,sqrt,2,4,1688,COMPLETE
44,0.8672615995898487,2025-09-18 17:32:46.360915,2025-09-18 17:32:56.207955,0 days 00:00:09.847040,False,balanced,entropy,8.0,1.0,5,7,1557,PRUNED
45,0.8558542681363752,2025-09-18 17:32:56.228104,2025-09-18 17:33:08.861012,0 days 00:00:12.632908,True,,entropy,32.0,0.5,17,4,1799,PRUNED
46,0.882610228146629,2025-09-18 17:33:08.880808,2025-09-18 17:33:22.453214,0 days 00:00:13.572406,False,balanced,entropy,16.0,1.0,2,2,1916,COMPLETE
47,0.8560273006921302,2025-09-18 17:33:22.474313,2025-09-18 17:33:33.269382,0 days 00:00:10.795069,False,balanced,entropy,16.0,log2,2,5,1928,COMPLETE
48,0.8699147654447577,2025-09-18 17:33:33.290027,2025-09-18 17:33:48.490212,0 days 00:00:15.200185,True,,entropy,16.0,1.0,3,13,1989,COMPLETE
49,0.8667809536016406,2025-09-18 17:33:48.510966,2025-09-18 17:33:56.351495,0 days 00:00:07.840529,False,balanced,gini,16.0,sqrt,2,18,1410,PRUNED
50,0.8696263778518329,2025-09-18 17:33:56.367747,2025-09-18 17:34:07.596652,0 days 00:00:11.228905,False,balanced,entropy,16.0,1.0,5,22,1686,COMPLETE
51,0.8787362214816714,2025-09-18 17:34:07.617954,2025-09-18 17:34:20.727584,0 days 00:00:13.109630,False,balanced,entropy,,1.0,4,3,1898,COMPLETE
52,0.8805594719302743,2025-09-18 17:34:20.749345,2025-09-18 17:34:33.989599,0 days 00:00:13.240254,False,balanced,entropy,,1.0,3,2,1871,COMPLETE
53,0.8809760317867212,2025-09-18 17:34:34.010464,2025-09-18 17:34:38.416170,0 days 00:00:04.405706,False,balanced,entropy,,1.0,3,7,561,COMPLETE
54,0.8818347859523199,2025-09-18 17:34:38.437871,2025-09-18 17:34:41.481338,0 days 00:00:03.043467,False,balanced,entropy,24.0,0.5,2,2,419,COMPLETE
55,0.8816168931043322,2025-09-18 17:34:41.501431,2025-09-18 17:34:45.091858,0 days 00:00:03.590427,False,balanced,entropy,24.0,0.5,2,2,496,COMPLETE
56,0.8818091514996155,2025-09-18 17:34:45.113081,2025-09-18 17:34:48.964235,0 days 00:00:03.851154,False,balanced,entropy,24.0,0.5,2,4,553,COMPLETE
57,0.8816136887977443,2025-09-18 17:34:48.985226,2025-09-18 17:34:52.665001,0 days 00:00:03.679775,False,balanced,entropy,24.0,0.5,2,5,517,COMPLETE
58,0.876945014098949,2025-09-18 17:34:52.685869,2025-09-18 17:34:56.472687,0 days 00:00:03.786818,False,balanced,entropy,24.0,0.5,2,11,541,COMPLETE
59,0.874942322481415,2025-09-18 17:34:56.493992,2025-09-18 17:34:59.795679,0 days 00:00:03.301687,True,,entropy,24.0,0.5,1,5,394,COMPLETE
60,0.869985260189695,2025-09-18 17:34:59.816696,2025-09-18 17:35:03.951066,0 days 00:00:04.134370,False,balanced,entropy,24.0,0.5,2,47,609,PRUNED
61,0.8794700076903357,2025-09-18 17:35:03.970465,2025-09-18 17:35:06.969052,0 days 00:00:02.998587,False,balanced,entropy,24.0,0.5,3,5,417,COMPLETE
62,0.8816729684696233,2025-09-18 17:35:06.990615,2025-09-18 17:35:09.012020,0 days 00:00:02.021405,False,balanced,entropy,24.0,0.5,1,4,246,COMPLETE
63,0.8807389130992054,2025-09-18 17:35:09.032665,2025-09-18 17:35:11.148023,0 days 00:00:02.115358,False,balanced,entropy,24.0,0.5,1,7,268,COMPLETE
64,0.8816425275570368,2025-09-18 17:35:11.169080,2025-09-18 17:35:14.610954,0 days 00:00:03.441874,False,balanced,entropy,24.0,0.5,2,4,483,COMPLETE
65,0.8813861830299923,2025-09-18 17:35:14.632110,2025-09-18 17:35:19.537449,0 days 00:00:04.905339,False,balanced,entropy,24.0,0.5,2,4,705,COMPLETE
66,0.8632626249679569,2025-09-18 17:35:19.558472,2025-09-18 17:35:21.886248,0 days 00:00:02.327776,False,balanced,entropy,24.0,0.5,1,33,322,COMPLETE
67,0.8795052550628043,2025-09-18 17:35:21.906744,2025-09-18 17:35:25.328267,0 days 00:00:03.421523,False,balanced,gini,24.0,0.5,2,4,486,COMPLETE
68,0.8559664188669572,2025-09-18 17:35:25.348756,2025-09-18 17:35:28.307672,0 days 00:00:02.958916,False,balanced,entropy,24.0,0.5,20,10,440,PRUNED
69,0.8611349653934888,2025-09-18 17:35:28.326578,2025-09-18 17:35:30.765955,0 days 00:00:02.439377,False,balanced,entropy,24.0,0.5,1,40,333,COMPLETE
70,0.8815143552935144,2025-09-18 17:35:30.787492,2025-09-18 17:35:36.191950,0 days 00:00:05.404458,False,balanced,entropy,24.0,0.5,2,3,775,COMPLETE
71,0.8813413227377594,2025-09-18 17:35:36.212805,2025-09-18 17:35:41.689192,0 days 00:00:05.476387,False,balanced,entropy,24.0,0.5,2,3,815,COMPLETE
72,0.8822609587285312,2025-09-18 17:35:41.709797,2025-09-18 17:35:46.476124,0 days 00:00:04.766327,False,balanced,entropy,24.0,0.5,1,6,686,COMPLETE
73,0.8802582671109972,2025-09-18 17:35:46.497304,2025-09-18 17:35:48.394239,0 days 00:00:01.896935,False,balanced,entropy,24.0,0.5,1,6,230,COMPLETE
74,0.8670853627275058,2025-09-18 17:35:48.415263,2025-09-18 17:35:51.774133,0 days 00:00:03.358870,False,balanced,entropy,24.0,0.5,13,9,502,PRUNED
75,0.8793738784926942,2025-09-18 17:35:51.792772,2025-09-18 17:35:56.255569,0 days 00:00:04.462797,False,balanced,entropy,24.0,0.5,3,6,655,COMPLETE
76,0.8612855678031275,2025-09-18 17:35:56.276974,2025-09-18 17:36:00.400298,0 days 00:00:04.123324,False,balanced,entropy,8.0,0.5,1,2,626,PRUNED
77,0.8794892335298641,2025-09-18 17:36:00.419247,2025-09-18 17:36:03.551840,0 days 00:00:03.132593,False,balanced,entropy,24.0,0.5,3,5,449,COMPLETE
78,0.8646020251217638,2025-09-18 17:36:03.572746,2025-09-18 17:36:05.992246,0 days 00:00:02.419500,False,balanced,gini,32.0,0.5,16,11,347,PRUNED
79,0.8728979748782363,2025-09-18 17:36:06.009821,2025-09-18 17:36:10.735500,0 days 00:00:04.725679,True,balanced,entropy,24.0,0.5,1,8,573,COMPLETE
80,0.8387592924891054,2025-09-18 17:36:10.756001,2025-09-18 17:36:12.551781,0 days 00:00:01.795780,False,,entropy,24.0,log2,10,3,295,PRUNED
81,0.8814630863881057,2025-09-18 17:36:12.569406,2025-09-18 17:36:17.832734,0 days 00:00:05.263328,False,balanced,entropy,24.0,0.5,2,3,787,COMPLETE
82,0.8815784414252755,2025-09-18 17:36:17.853654,2025-09-18 17:36:22.526540,0 days 00:00:04.672886,False,balanced,entropy,24.0,0.5,2,4,675,COMPLETE
83,0.8820943347859524,2025-09-18 17:36:22.549252,2025-09-18 17:36:27.046831,0 days 00:00:04.497579,False,balanced,entropy,24.0,0.5,2,5,668,COMPLETE
84,0.8800948474750065,2025-09-18 17:36:27.067599,2025-09-18 17:36:30.562189,0 days 00:00:03.494590,False,balanced,entropy,16.0,0.5,1,6,497,COMPLETE
85,0.8655953601640606,2025-09-18 17:36:30.582964,2025-09-18 17:36:34.944484,0 days 00:00:04.361520,False,balanced,entropy,24.0,sqrt,3,5,733,COMPLETE
86,0.8786048449115611,2025-09-18 17:36:34.964869,2025-09-18 17:36:40.779478,0 days 00:00:05.814609,False,balanced,entropy,24.0,0.5,2,9,892,COMPLETE
87,0.8794603947705717,2025-09-18 17:36:40.800993,2025-09-18 17:36:43.486703,0 days 00:00:02.685710,False,balanced,entropy,24.0,0.5,3,2,368,COMPLETE
88,0.8628877210971546,2025-09-18 17:36:43.506684,2025-09-18 17:36:49.472800,0 days 00:00:05.966116,False,balanced,entropy,8.0,0.5,5,7,954,PRUNED
89,0.86816521404768,2025-09-18 17:36:49.490519,2025-09-18 17:36:53.154524,0 days 00:00:03.664005,False,balanced,entropy,16.0,0.5,1,25,545,COMPLETE
90,0.8749455267880031,2025-09-18 17:36:53.175072,2025-09-18 17:36:57.141775,0 days 00:00:03.966703,False,balanced,gini,32.0,0.5,4,5,603,COMPLETE
91,0.8815784414252755,2025-09-18 17:36:57.167109,2025-09-18 17:37:01.657919,0 days 00:00:04.490810,False,balanced,entropy,24.0,0.5,2,4,658,COMPLETE
92,0.8815303768264549,2025-09-18 17:37:01.678881,2025-09-18 17:37:06.246219,0 days 00:00:04.567338,False,balanced,entropy,24.0,0.5,2,2,671,COMPLETE
93,0.8777589079723148,2025-09-18 17:37:06.268360,2025-09-18 17:37:09.843154,0 days 00:00:03.574794,False,balanced,entropy,24.0,0.5,3,8,521,COMPLETE
94,0.867992181491925,2025-09-18 17:37:09.863489,2025-09-18 17:37:12.626117,0 days 00:00:02.762628,False,balanced,entropy,24.0,log2,1,6,449,COMPLETE
95,0.8813893873365805,2025-09-18 17:37:12.646681,2025-09-18 17:37:17.404113,0 days 00:00:04.757432,False,balanced,entropy,24.0,0.5,2,4,710,COMPLETE
96,0.8664124583440144,2025-09-18 17:37:17.426225,2025-09-18 17:37:20.800074,0 days 00:00:03.373849,False,,entropy,24.0,sqrt,3,4,580,COMPLETE
97,0.8721802102025122,2025-09-18 17:37:20.820086,2025-09-18 17:37:24.178158,0 days 00:00:03.358072,True,balanced,entropy,24.0,0.5,1,7,397,COMPLETE
98,0.8583376057421174,2025-09-18 17:37:24.199226,2025-09-18 17:37:29.443278,0 days 00:00:05.244052,False,balanced,entropy,16.0,0.5,19,2,833,PRUNED
99,0.8798449115611382,2025-09-18 17:37:29.462445,2025-09-18 17:37:31.485842,0 days 00:00:02.023397,False,balanced,entropy,24.0,0.5,2,3,250,COMPLETE
100,0.8739682132786465,2025-09-18 18:34:37.085962,2025-09-18 18:34:40.285040,0 days 00:00:03.199078,False,balanced,entropy,24.0,0.5,4,12,468,COMPLETE
101,0.8814438605485773,2025-09-18 18:34:40.307007,2025-09-18 18:34:44.852422,0 days 00:00:04.545415,False,balanced,entropy,24.0,0.5,2,4,669,COMPLETE
102,0.8822193027428865,2025-09-18 18:34:44.872213,2025-09-18 18:34:50.030444,0 days 00:00:05.158231,False,balanced,entropy,24.0,0.5,2,5,745,COMPLETE
103,0.8825173032555755,2025-09-18 18:34:50.050080,2025-09-18 18:34:55.285511,0 days 00:00:05.235431,False,balanced,entropy,24.0,0.5,1,6,755,COMPLETE
104,0.8820622917200718,2025-09-18 18:34:55.306185,2025-09-18 18:34:59.651210,0 days 00:00:04.345025,False,balanced,entropy,24.0,0.5,1,6,616,COMPLETE
105,0.8808831068956678,2025-09-18 18:34:59.671541,2025-09-18 18:35:04.671443,0 days 00:00:04.999902,False,balanced,entropy,24.0,0.5,1,8,728,COMPLETE
106,0.8823891309920533,2025-09-18 18:35:04.692028,2025-09-18 18:35:09.951085,0 days 00:00:05.259057,False,balanced,entropy,24.0,0.5,1,6,746,COMPLETE
107,0.8789701358625994,2025-09-18 18:35:09.971456,2025-09-18 18:35:15.291222,0 days 00:00:05.319766,False,balanced,entropy,16.0,0.8,1,9,761,COMPLETE
108,0.8815367854396309,2025-09-18 18:35:15.312418,2025-09-18 18:35:21.939198,0 days 00:00:06.626780,False,balanced,entropy,24.0,0.5,1,7,1022,COMPLETE
109,0.8631440656241989,2025-09-18 18:35:21.960012,2025-09-18 18:35:27.102625,0 days 00:00:05.142613,False,balanced,entropy,8.0,0.5,1,6,835,PRUNED
110,0.853306844398872,2025-09-18 18:35:27.121763,2025-09-18 18:35:33.055609,0 days 00:00:05.933846,True,balanced,gini,24.0,log2,3,10,862,PRUNED
111,0.8815880543450396,2025-09-18 18:35:33.073630,2025-09-18 18:35:37.267010,0 days 00:00:04.193380,False,balanced,entropy,24.0,0.5,2,3,613,COMPLETE
112,0.882607023840041,2025-09-18 18:35:37.288211,2025-09-18 18:35:41.280036,0 days 00:00:03.991825,False,balanced,entropy,24.0,0.5,1,5,578,COMPLETE
113,0.8827864650089721,2025-09-18 18:35:41.299925,2025-09-18 18:35:46.473244,0 days 00:00:05.173319,False,balanced,entropy,24.0,0.5,1,5,755,COMPLETE
114,0.882847346834145,2025-09-18 18:35:46.494806,2025-09-18 18:35:51.639107,0 days 00:00:05.144301,False,balanced,entropy,24.0,0.5,1,5,765,COMPLETE
115,0.8823218405537041,2025-09-18 18:35:51.660601,2025-09-18 18:35:56.871520,0 days 00:00:05.210919,False,balanced,entropy,32.0,0.5,1,6,760,COMPLETE
116,0.883021981543194,2025-09-18 18:35:56.891448,2025-09-18 18:36:01.870512,0 days 00:00:04.979064,False,,entropy,32.0,0.5,1,6,759,COMPLETE
117,0.8700333247885158,2025-09-18 18:36:01.891736,2025-09-18 18:36:06.995953,0 days 00:00:05.104217,False,,entropy,32.0,sqrt,1,11,929,COMPLETE
118,0.882071904639836,2025-09-18 18:36:07.015713,2025-09-18 18:36:11.871962,0 days 00:00:04.856249,False,,entropy,32.0,0.5,1,8,740,COMPLETE
119,0.8819693668290182,2025-09-18 18:36:11.891859,2025-09-18 18:36:16.771345,0 days 00:00:04.879486,False,,entropy,32.0,0.5,1,8,757,COMPLETE
120,0.8803768264547551,2025-09-18 18:36:16.791846,2025-09-18 18:36:21.410558,0 days 00:00:04.618712,False,,entropy,32.0,0.5,1,9,700,COMPLETE
121,0.8830892719815431,2025-09-18 18:36:21.430145,2025-09-18 18:36:26.611025,0 days 00:00:05.180880,False,,entropy,32.0,0.5,1,6,802,COMPLETE
122,0.869462958215842,2025-09-18 18:36:26.632132,2025-09-18 18:36:31.625772,0 days 00:00:04.993640,False,,entropy,32.0,0.5,1,28,792,COMPLETE
123,0.8821984747500642,2025-09-18 18:36:31.648892,2025-09-18 18:36:37.356676,0 days 00:00:05.707784,False,,entropy,32.0,0.5,1,5,885,COMPLETE
124,0.8821888618303,2025-09-18 18:36:37.377047,2025-09-18 18:36:43.142155,0 days 00:00:05.765108,False,,entropy,32.0,0.5,1,5,876,COMPLETE
125,0.8829755190976674,2025-09-18 18:36:43.162590,2025-09-18 18:36:48.777912,0 days 00:00:05.615322,False,,entropy,32.0,0.5,1,6,875,COMPLETE
126,0.872641630351192,2025-09-18 18:36:48.797836,2025-09-18 18:36:54.276908,0 days 00:00:05.479072,False,,entropy,32.0,0.8,1,22,812,COMPLETE
127,0.8823122276339399,2025-09-18 18:36:54.299414,2025-09-18 18:37:00.125602,0 days 00:00:05.826188,False,,entropy,32.0,0.5,1,7,909,COMPLETE
128,0.8815560112791593,2025-09-18 18:37:00.146714,2025-09-18 18:37:06.477284,0 days 00:00:06.330570,False,,entropy,32.0,0.5,2,7,996,COMPLETE
129,0.8822881953345296,2025-09-18 18:37:06.497833,2025-09-18 18:37:12.510420,0 days 00:00:06.012587,False,,entropy,32.0,0.5,1,7,924,COMPLETE
130,0.8648904127146886,2025-09-18 18:37:12.530253,2025-09-18 18:37:18.982520,0 days 00:00:06.452267,False,,entropy,32.0,0.5,15,10,1136,PRUNED
131,0.8823442706998204,2025-09-18 18:37:19.000143,2025-09-18 18:37:24.925995,0 days 00:00:05.925852,False,,entropy,32.0,0.5,1,7,915,COMPLETE
132,0.8817546782876186,2025-09-18 18:37:24.946269,2025-09-18 18:37:31.782612,0 days 00:00:06.836343,False,,entropy,32.0,0.5,1,7,1076,COMPLETE
133,0.8806684183542682,2025-09-18 18:37:31.802472,2025-09-18 18:37:37.785046,0 days 00:00:05.982574,False,,entropy,32.0,0.5,1,9,931,COMPLETE
134,0.882844142527557,2025-09-18 18:37:37.807221,2025-09-18 18:37:43.965375,0 days 00:00:06.158154,False,,entropy,32.0,0.5,1,6,976,COMPLETE
135,0.8821167649320687,2025-09-18 18:37:43.985598,2025-09-18 18:37:50.123789,0 days 00:00:06.138191,False,,entropy,32.0,0.5,1,7,972,COMPLETE
136,0.8654960266598308,2025-09-18 18:37:50.143405,2025-09-18 18:37:55.618296,0 days 00:00:05.474891,False,,gini,32.0,0.5,8,6,900,COMPLETE
137,0.8707158420917713,2025-09-18 18:37:55.637683,2025-09-18 18:38:01.987037,0 days 00:00:06.349354,True,,entropy,32.0,0.5,2,9,854,COMPLETE
138,0.8779191233017174,2025-09-18 18:38:02.007748,2025-09-18 18:38:08.327047,0 days 00:00:06.319299,False,,entropy,32.0,0.5,1,12,1011,COMPLETE
139,0.8813941937964624,2025-09-18 18:38:08.347087,2025-09-18 18:38:13.536237,0 days 00:00:05.189150,False,,entropy,32.0,0.5,2,7,811,COMPLETE
140,0.8675788259420661,2025-09-18 18:38:13.555875,2025-09-18 18:38:19.086954,0 days 00:00:05.531079,False,,entropy,32.0,log2,1,8,1058,COMPLETE
141,0.8828761855934376,2025-09-18 18:38:19.107153,2025-09-18 18:38:25.063797,0 days 00:00:05.956644,False,,entropy,32.0,0.5,1,6,927,COMPLETE
142,0.8828697769802615,2025-09-18 18:38:25.083974,2025-09-18 18:38:31.312728,0 days 00:00:06.228754,False,,entropy,32.0,0.5,1,6,975,COMPLETE
143,0.8812916559856447,2025-09-18 18:38:31.332402,2025-09-18 18:38:37.431154,0 days 00:00:06.098752,False,,entropy,32.0,0.5,2,6,977,COMPLETE
144,0.8830620353755447,2025-09-18 18:38:37.451356,2025-09-18 18:38:42.919762,0 days 00:00:05.468406,False,,entropy,32.0,0.5,1,6,848,COMPLETE
145,0.8823554857728787,2025-09-18 18:38:42.939840,2025-09-18 18:38:48.362430,0 days 00:00:05.422590,False,,entropy,32.0,0.5,2,3,846,COMPLETE
146,0.8662650602409638,2025-09-18 18:38:48.382559,2025-09-18 18:38:52.948760,0 days 00:00:04.566201,False,,entropy,32.0,sqrt,3,3,854,COMPLETE
147,0.8824083568315817,2025-09-18 18:38:52.968626,2025-09-18 18:39:00.008103,0 days 00:00:07.039477,False,,entropy,32.0,0.5,2,3,1113,COMPLETE
