number,value,datetime_start,datetime_complete,duration,params_bootstrap,params_class_weight,params_criterion,params_max_depth,params_max_features,params_min_samples_leaf,params_min_samples_split,params_n_estimators,state
0,0.8647282240904131,2025-09-18 17:37:42.817850,2025-09-18 17:37:47.498348,0 days 00:00:04.680498,True,,gini,16.0,log2,9,35,645,COMPLETE
1,0.9025238364330823,2025-09-18 17:37:47.521864,2025-09-18 17:37:51.027764,0 days 00:00:03.505900,False,balanced,gini,24.0,1.0,9,40,485,COMPLETE
2,0.8539185452461832,2025-09-18 17:37:51.047622,2025-09-18 17:38:02.040701,0 days 00:00:10.993079,True,balanced,entropy,16.0,log2,11,43,1629,COMPLETE
3,0.8926823435945824,2025-09-18 17:38:02.062831,2025-09-18 17:38:16.024624,0 days 00:00:13.961793,True,,gini,16.0,1.0,18,42,1927,COMPLETE
4,0.8947019418595265,2025-09-18 17:38:16.049340,2025-09-18 17:38:20.324873,0 days 00:00:04.275533,False,,entropy,,sqrt,5,37,799,COMPLETE
5,0.8387908910762434,2025-09-18 17:38:20.345274,2025-09-18 17:38:27.891427,0 days 00:00:07.546153,True,,entropy,8.0,log2,8,20,1872,PRUNED
6,0.8465224312120325,2025-09-18 17:38:27.911372,2025-09-18 17:38:33.548780,0 days 00:00:05.637408,True,,gini,32.0,sqrt,20,17,1334,PRUNED
7,0.8399441250040606,2025-09-18 17:38:33.567759,2025-09-18 17:38:40.493864,0 days 00:00:06.926105,True,,entropy,16.0,log2,14,36,1729,PRUNED
8,0.9035825141808143,2025-09-18 17:38:40.510781,2025-09-18 17:38:51.783672,0 days 00:00:11.272891,True,,entropy,16.0,0.8,3,35,1529,COMPLETE
9,0.8892984531070018,2025-09-18 17:38:51.804485,2025-09-18 17:38:54.508588,0 days 00:00:02.704103,True,,entropy,12.0,sqrt,1,42,369,COMPLETE
10,0.9145050703291228,2025-09-18 17:38:54.528934,2025-09-18 17:39:02.341429,0 days 00:00:07.812495,False,balanced,entropy,12.0,0.8,1,6,1150,COMPLETE
11,0.9138800628252559,2025-09-18 17:39:02.362546,2025-09-18 17:39:10.088522,0 days 00:00:07.725976,False,balanced,entropy,12.0,0.8,1,5,1106,COMPLETE
12,0.9143058304593324,2025-09-18 17:39:10.110173,2025-09-18 17:39:17.611180,0 days 00:00:07.501007,False,balanced,entropy,12.0,0.8,1,2,1053,COMPLETE
13,0.9104508469190744,2025-09-18 17:39:17.632066,2025-09-18 17:39:23.767495,0 days 00:00:06.135429,False,balanced,entropy,12.0,0.5,6,2,971,COMPLETE
14,0.9121895827065124,2025-09-18 17:39:23.792680,2025-09-18 17:39:31.906560,0 days 00:00:08.113880,False,balanced,entropy,12.0,0.8,5,10,1216,COMPLETE
15,0.9125504082933957,2025-09-18 17:39:31.928202,2025-09-18 17:39:38.404724,0 days 00:00:06.476522,False,balanced,entropy,12.0,0.8,3,12,954,COMPLETE
16,0.9030715637607919,2025-09-18 17:39:38.426023,2025-09-18 17:39:47.347530,0 days 00:00:08.921507,False,balanced,entropy,,0.8,14,27,1403,COMPLETE
17,0.9122892505603742,2025-09-18 17:39:47.369303,2025-09-18 17:39:51.253771,0 days 00:00:03.884468,False,balanced,entropy,8.0,0.5,3,9,756,PRUNED
18,0.9033506589487301,2025-09-18 17:39:51.273460,2025-09-18 17:39:59.021489,0 days 00:00:07.748029,False,balanced,gini,32.0,0.8,1,50,1160,COMPLETE
19,0.9084220947563608,2025-09-18 17:39:59.042267,2025-09-18 17:40:00.740355,0 days 00:00:01.698088,False,balanced,entropy,24.0,0.8,7,25,200,COMPLETE
20,0.9043457489683169,2025-09-18 17:40:00.760712,2025-09-18 17:40:06.816827,0 days 00:00:06.056115,False,balanced,entropy,12.0,0.8,12,15,913,COMPLETE
21,0.9156504858491324,2025-09-18 17:40:06.837478,2025-09-18 17:40:14.221426,0 days 00:00:07.383948,False,balanced,entropy,12.0,0.8,1,4,1070,COMPLETE
22,0.9136417185400058,2025-09-18 17:40:14.243127,2025-09-18 17:40:22.886711,0 days 00:00:08.643584,False,balanced,entropy,12.0,0.8,3,2,1314,COMPLETE
23,0.9128299122205984,2025-09-18 17:40:22.906839,2025-09-18 17:40:29.951241,0 days 00:00:07.044402,False,balanced,entropy,12.0,0.8,4,6,1036,COMPLETE
24,0.9135658209265257,2025-09-18 17:40:29.973376,2025-09-18 17:40:36.371704,0 days 00:00:06.398328,False,balanced,entropy,12.0,1.0,1,6,817,COMPLETE
25,0.9119295761922835,2025-09-18 17:40:36.393301,2025-09-18 17:40:45.265566,0 days 00:00:08.872265,False,balanced,entropy,12.0,0.5,2,13,1430,COMPLETE
26,0.9173244972874638,2025-09-18 17:40:45.288018,2025-09-18 17:40:51.723962,0 days 00:00:06.435944,False,balanced,gini,12.0,0.8,6,20,1226,PRUNED
27,0.914912940916771,2025-09-18 17:40:51.743456,2025-09-18 17:40:56.405908,0 days 00:00:04.662452,False,balanced,entropy,,0.8,4,8,660,COMPLETE
28,0.9137142806549132,2025-09-18 17:40:56.426652,2025-09-18 17:41:00.732955,0 days 00:00:04.306303,False,balanced,entropy,,0.8,5,8,598,COMPLETE
29,0.9044653955404452,2025-09-18 17:41:00.754161,2025-09-18 17:41:04.960233,0 days 00:00:04.206072,False,balanced,gini,,0.8,9,30,635,COMPLETE
30,0.9013509852419844,2025-09-18 17:41:04.984702,2025-09-18 17:41:08.059432,0 days 00:00:03.074730,False,balanced,entropy,,sqrt,4,17,506,COMPLETE
31,0.9182523108762947,2025-09-18 17:41:08.080089,2025-09-18 17:41:15.466833,0 days 00:00:07.386744,False,balanced,entropy,24.0,0.8,2,2,1039,COMPLETE
32,0.9182187321629449,2025-09-18 17:41:15.488805,2025-09-18 17:41:21.956273,0 days 00:00:06.467468,False,balanced,entropy,24.0,0.8,2,5,877,COMPLETE
33,0.9148729192709382,2025-09-18 17:41:21.977104,2025-09-18 17:41:27.481560,0 days 00:00:05.504456,False,balanced,entropy,24.0,1.0,4,11,744,COMPLETE
34,0.91165308629403,2025-09-18 17:41:27.502188,2025-09-18 17:41:32.557156,0 days 00:00:05.054968,False,balanced,gini,24.0,log2,2,4,867,COMPLETE
35,0.9113104613461445,2025-09-18 17:41:32.579760,2025-09-18 17:41:37.230662,0 days 00:00:04.650902,False,balanced,entropy,24.0,0.8,7,8,680,COMPLETE
36,0.917585765350468,2025-09-18 17:41:37.251912,2025-09-18 17:41:40.768590,0 days 00:00:03.516678,False,balanced,entropy,24.0,1.0,2,4,423,COMPLETE
37,0.9007192916142348,2025-09-18 17:41:40.789178,2025-09-18 17:41:43.492370,0 days 00:00:02.703192,True,balanced,entropy,24.0,1.0,11,14,321,COMPLETE
38,0.9159885730930263,2025-09-18 17:41:43.513039,2025-09-18 17:41:47.694562,0 days 00:00:04.181523,False,,gini,24.0,1.0,2,4,534,COMPLETE
39,0.8943264252483744,2025-09-18 17:41:47.716140,2025-09-18 17:41:51.470559,0 days 00:00:03.754419,True,,gini,24.0,1.0,17,21,464,COMPLETE
40,0.9160617117164719,2025-09-18 17:41:51.492250,2025-09-18 17:41:55.851413,0 days 00:00:04.359163,False,,gini,24.0,1.0,2,2,544,COMPLETE
41,0.9163595937838332,2025-09-18 17:41:55.872445,2025-09-18 17:41:59.739896,0 days 00:00:03.867451,False,,gini,24.0,1.0,2,2,448,COMPLETE
42,0.9164332616844291,2025-09-18 17:41:59.760587,2025-09-18 17:42:02.896951,0 days 00:00:03.136364,False,,gini,24.0,1.0,2,2,374,COMPLETE
43,0.9140121753631499,2025-09-18 17:42:02.917319,2025-09-18 17:42:05.965779,0 days 00:00:03.048460,False,,gini,24.0,1.0,3,7,374,COMPLETE
44,0.9114615893041396,2025-09-18 17:42:05.986333,2025-09-18 17:42:07.806888,0 days 00:00:01.820555,False,,gini,24.0,1.0,5,10,209,COMPLETE
45,0.9104826451201837,2025-09-18 17:42:07.827372,2025-09-18 17:42:11.489172,0 days 00:00:03.661800,True,,gini,24.0,1.0,2,4,430,COMPLETE
46,0.9080241381057197,2025-09-18 17:42:11.510480,2025-09-18 17:42:13.795291,0 days 00:00:02.284811,False,,gini,24.0,1.0,9,2,292,COMPLETE
47,0.8398953968099276,2025-09-18 17:42:13.817358,2025-09-18 17:42:15.243581,0 days 00:00:01.426223,False,,gini,8.0,log2,6,5,405,PRUNED
48,0.8964613219416938,2025-09-18 17:42:15.260205,2025-09-18 17:42:17.462209,0 days 00:00:02.202004,True,,gini,16.0,sqrt,3,16,286,COMPLETE
49,0.8981626815699094,2025-09-18 17:42:17.483327,2025-09-18 17:42:21.423145,0 days 00:00:03.939818,False,,gini,32.0,1.0,20,11,588,COMPLETE
50,0.920053276158919,2025-09-18 17:42:21.444313,2025-09-18 17:42:30.660737,0 days 00:00:09.216424,False,,gini,24.0,1.0,7,7,1749,PRUNED
51,0.9159495255350599,2025-09-18 17:42:30.681404,2025-09-18 17:42:34.924393,0 days 00:00:04.242989,False,,gini,24.0,1.0,2,2,524,COMPLETE
52,0.9165975833841058,2025-09-18 17:42:34.944196,2025-09-18 17:42:40.436844,0 days 00:00:05.492648,False,,gini,24.0,1.0,2,2,739,COMPLETE
53,0.9144042192047095,2025-09-18 17:42:40.457049,2025-09-18 17:42:45.973094,0 days 00:00:05.516045,False,,gini,24.0,1.0,4,4,744,COMPLETE
54,0.9173178287232908,2025-09-18 17:42:45.993661,2025-09-18 17:42:52.275278,0 days 00:00:06.281617,False,,gini,24.0,0.5,1,6,966,COMPLETE
55,0.9172070248401027,2025-09-18 17:42:52.298046,2025-09-18 17:42:58.149844,0 days 00:00:05.851798,False,,gini,24.0,0.5,1,6,899,COMPLETE
56,0.9178929928856837,2025-09-18 17:42:58.171142,2025-09-18 17:43:02.803485,0 days 00:00:04.632343,False,,entropy,16.0,0.5,1,39,957,PRUNED
57,0.9135724263392132,2025-09-18 17:43:02.827301,2025-09-18 17:43:06.838130,0 days 00:00:04.010829,False,,entropy,8.0,0.5,1,9,850,PRUNED
58,0.9135724263392131,2025-09-18 17:43:06.859229,2025-09-18 17:43:11.669009,0 days 00:00:04.809780,False,,gini,32.0,0.5,3,48,1001,PRUNED
59,0.892884305113579,2025-09-18 17:43:11.686325,2025-09-18 17:43:18.298389,0 days 00:00:06.612064,True,balanced,entropy,24.0,0.5,16,6,912,COMPLETE
60,0.9160575682596951,2025-09-18 17:43:18.319460,2025-09-18 17:43:25.587393,0 days 00:00:07.267933,False,,entropy,24.0,0.5,1,12,1127,COMPLETE
61,0.916002490961166,2025-09-18 17:43:25.610222,2025-09-18 17:43:30.672172,0 days 00:00:05.061950,False,,gini,24.0,0.5,3,5,779,COMPLETE
62,0.9163336906734236,2025-09-18 17:43:30.693388,2025-09-18 17:43:36.488406,0 days 00:00:05.795018,False,,gini,24.0,0.5,2,33,1236,PRUNED
63,0.91113456986058,2025-09-18 17:43:36.505998,2025-09-18 17:43:40.405730,0 days 00:00:03.899732,False,,gini,24.0,log2,1,7,706,COMPLETE
64,0.9082292713737076,2025-09-18 17:43:40.426668,2025-09-18 17:43:45.928368,0 days 00:00:05.501700,False,,gini,24.0,sqrt,4,3,1003,COMPLETE
65,0.9118927337001388,2025-09-18 17:43:45.949105,2025-09-18 17:43:51.560408,0 days 00:00:05.611303,False,balanced,gini,24.0,0.5,5,5,887,COMPLETE
66,0.9162457793624817,2025-09-18 17:43:51.582074,2025-09-18 17:43:58.519300,0 days 00:00:06.937226,False,balanced,entropy,24.0,0.5,2,10,1077,COMPLETE
67,0.9139135245443961,2025-09-18 17:43:58.541016,2025-09-18 17:44:04.106860,0 days 00:00:05.565844,False,,gini,24.0,0.8,3,9,818,COMPLETE
68,0.9074281169222361,2025-09-18 17:44:04.128838,2025-09-18 17:44:09.536845,0 days 00:00:05.408007,False,balanced,entropy,16.0,log2,1,6,941,COMPLETE
69,0.9118994250073091,2025-09-18 17:44:09.557227,2025-09-18 17:44:15.271980,0 days 00:00:05.714753,False,balanced,entropy,8.0,0.5,3,3,1167,PRUNED
70,0.9158824624124632,2025-09-18 17:44:15.292438,2025-09-18 17:44:22.277700,0 days 00:00:06.985262,False,,gini,32.0,sqrt,1,8,1313,COMPLETE
71,0.9161921156734657,2025-09-18 17:44:22.298580,2025-09-18 17:44:26.024706,0 days 00:00:03.726126,False,,gini,24.0,1.0,2,3,467,COMPLETE
72,0.9165957054472113,2025-09-18 17:44:26.045672,2025-09-18 17:44:40.463593,0 days 00:00:14.417921,False,,gini,24.0,1.0,2,3,1996,COMPLETE
73,0.9158696426608618,2025-09-18 17:44:40.484527,2025-09-18 17:44:54.185139,0 days 00:00:13.700612,False,,gini,24.0,1.0,3,5,1969,COMPLETE
74,0.9046033070666525,2025-09-18 17:44:54.206130,2025-09-18 17:45:00.964130,0 days 00:00:06.758000,False,,gini,24.0,1.0,13,7,1020,COMPLETE
75,0.9138488414500288,2025-09-18 17:45:00.986097,2025-09-18 17:45:10.867208,0 days 00:00:09.881111,False,balanced,gini,24.0,0.8,4,3,1490,COMPLETE
76,0.908657541583746,2025-09-18 17:45:10.888634,2025-09-18 17:45:22.784444,0 days 00:00:11.895810,False,,entropy,24.0,1.0,10,5,1873,COMPLETE
77,0.9169170814539817,2025-09-18 17:45:22.807407,2025-09-18 17:45:28.992535,0 days 00:00:06.185128,False,balanced,gini,24.0,0.8,2,3,833,COMPLETE
78,0.9207354708767825,2025-09-18 17:45:29.013813,2025-09-18 17:45:34.230940,0 days 00:00:05.217127,True,balanced,entropy,24.0,0.8,1,13,846,PRUNED
79,0.9166307796977557,2025-09-18 17:45:34.249599,2025-09-18 17:45:39.342897,0 days 00:00:05.093298,False,balanced,gini,24.0,0.8,2,4,710,COMPLETE
80,0.8977403404063949,2025-09-18 17:45:39.362912,2025-09-18 17:45:43.922569,0 days 00:00:04.559657,False,balanced,entropy,24.0,0.8,19,9,721,COMPLETE
81,0.9164904046289172,2025-09-18 17:45:43.942721,2025-09-18 17:45:48.590197,0 days 00:00:04.647476,False,balanced,gini,24.0,0.8,2,4,618,COMPLETE
82,0.9152200676423285,2025-09-18 17:45:48.610420,2025-09-18 17:45:54.650683,0 days 00:00:06.040263,False,balanced,gini,24.0,0.8,1,6,823,COMPLETE
83,0.9135009577922444,2025-09-18 17:45:54.671682,2025-09-18 17:46:00.922482,0 days 00:00:06.250800,False,balanced,gini,,0.8,4,3,907,COMPLETE
84,0.9191924113959004,2025-09-18 17:46:00.944358,2025-09-18 17:46:09.525029,0 days 00:00:08.580671,False,balanced,gini,24.0,0.8,2,23,1617,PRUNED
85,0.9147267131091368,2025-09-18 17:46:09.544197,2025-09-18 17:46:15.028880,0 days 00:00:05.484683,False,balanced,gini,24.0,0.8,3,7,773,COMPLETE
86,0.9163944780510136,2025-09-18 17:46:15.049893,2025-09-18 17:46:20.017955,0 days 00:00:04.968062,False,balanced,gini,24.0,0.8,2,4,675,COMPLETE
87,0.9164094373897607,2025-09-18 17:46:20.039827,2025-09-18 17:46:27.071855,0 days 00:00:07.032028,False,balanced,gini,24.0,0.8,1,2,953,COMPLETE
88,0.9169434367798039,2025-09-18 17:46:27.093524,2025-09-18 17:46:34.243100,0 days 00:00:07.149576,False,balanced,entropy,24.0,0.8,3,6,1050,COMPLETE
89,0.909739141734074,2025-09-18 17:46:34.264181,2025-09-18 17:46:39.345560,0 days 00:00:05.081379,False,balanced,entropy,8.0,0.8,8,8,990,PRUNED
90,0.9218562193418445,2025-09-18 17:46:39.363665,2025-09-18 17:46:45.871105,0 days 00:00:06.507440,True,balanced,entropy,32.0,0.8,3,11,1066,PRUNED
91,0.9182449200368378,2025-09-18 17:46:45.890287,2025-09-18 17:46:52.040961,0 days 00:00:06.150674,False,balanced,entropy,24.0,0.8,2,5,872,COMPLETE
92,0.9170589416934393,2025-09-18 17:46:52.064526,2025-09-18 17:46:58.515121,0 days 00:00:06.450595,False,balanced,entropy,24.0,0.8,1,6,875,COMPLETE
93,0.9179850952550248,2025-09-18 17:46:58.536381,2025-09-18 17:47:05.956178,0 days 00:00:07.419797,False,balanced,entropy,24.0,0.8,1,5,1049,COMPLETE
94,0.9171727944076513,2025-09-18 17:47:05.978867,2025-09-18 17:47:13.319810,0 days 00:00:07.340943,False,balanced,entropy,24.0,0.8,1,7,1040,COMPLETE
95,0.9172577568509762,2025-09-18 17:47:13.344212,2025-09-18 17:47:21.580802,0 days 00:00:08.236590,False,balanced,entropy,24.0,0.8,1,6,1180,COMPLETE
96,0.9155008647469398,2025-09-18 17:47:21.602384,2025-09-18 17:47:29.744872,0 days 00:00:08.142488,False,balanced,entropy,16.0,0.8,1,10,1167,COMPLETE
97,0.9169769086539571,2025-09-18 17:47:29.766533,2025-09-18 17:47:37.396675,0 days 00:00:07.630142,False,balanced,entropy,24.0,0.8,1,8,1110,COMPLETE
98,0.9130062304282625,2025-09-18 17:47:37.418296,2025-09-18 17:47:46.055139,0 days 00:00:08.636843,False,balanced,entropy,,0.8,1,18,1282,COMPLETE
99,0.9166144885185045,2025-09-18 17:47:46.077822,2025-09-18 17:47:54.269552,0 days 00:00:08.191730,False,balanced,entropy,24.0,0.8,1,9,1213,COMPLETE
100,0.916789282733782,2025-09-18 18:46:25.603465,2025-09-18 18:46:31.771798,0 days 00:00:06.168333,False,balanced,entropy,24.0,0.8,1,7,879,COMPLETE
101,0.917975628455924,2025-09-18 18:46:31.794829,2025-09-18 18:46:39.447322,0 days 00:00:07.652493,False,balanced,entropy,24.0,0.8,1,5,1109,COMPLETE
102,0.917975628455924,2025-09-18 18:46:39.468897,2025-09-18 18:46:47.161590,0 days 00:00:07.692693,False,balanced,entropy,24.0,0.8,1,5,1109,COMPLETE
103,0.9182778984408385,2025-09-18 18:46:47.182683,2025-09-18 18:46:54.756783,0 days 00:00:07.574100,False,balanced,entropy,24.0,0.8,2,5,1102,COMPLETE
104,0.9186352168459644,2025-09-18 18:46:54.777412,2025-09-18 18:47:01.952133,0 days 00:00:07.174721,False,balanced,entropy,24.0,0.5,2,5,1136,COMPLETE
105,0.9183168352985875,2025-09-18 18:47:01.972568,2025-09-18 18:47:11.000539,0 days 00:00:09.027971,False,balanced,entropy,24.0,0.8,2,5,1368,COMPLETE
106,0.9170476662442499,2025-09-18 18:47:11.021344,2025-09-18 18:47:18.368854,0 days 00:00:07.347510,False,balanced,entropy,24.0,0.8,3,5,1094,COMPLETE
107,0.8829061494980995,2025-09-18 18:47:18.389122,2025-09-18 18:47:23.017275,0 days 00:00:04.628153,False,balanced,entropy,24.0,log2,2,29,1368,PRUNED
108,0.9140591134718272,2025-09-18 18:47:23.036737,2025-09-18 18:47:31.426826,0 days 00:00:08.390089,True,balanced,entropy,24.0,0.5,2,4,1128,COMPLETE
109,0.906478598262966,2025-09-18 18:47:31.448281,2025-09-18 18:47:38.755617,0 days 00:00:07.307336,False,balanced,entropy,24.0,sqrt,4,5,1266,COMPLETE
110,0.9141246792060553,2025-09-18 18:47:38.776491,2025-09-18 18:47:44.826846,0 days 00:00:06.050355,False,balanced,entropy,12.0,0.8,3,46,1201,PRUNED
111,0.9183037716151166,2025-09-18 18:47:44.843093,2025-09-18 18:47:52.712149,0 days 00:00:07.869056,False,balanced,entropy,24.0,0.8,2,5,1178,COMPLETE
112,0.9185057187478449,2025-09-18 18:47:52.732309,2025-09-18 18:48:02.449323,0 days 00:00:09.717014,False,balanced,entropy,24.0,0.8,2,5,1426,COMPLETE
113,0.9185285035288617,2025-09-18 18:48:02.470201,2025-09-18 18:48:12.061672,0 days 00:00:09.591471,False,balanced,entropy,24.0,0.8,2,5,1438,COMPLETE
114,0.9167343011674044,2025-09-18 18:48:12.083774,2025-09-18 18:48:21.705181,0 days 00:00:09.621407,False,balanced,entropy,24.0,0.8,2,8,1437,COMPLETE
115,0.9169563991247098,2025-09-18 18:48:21.725909,2025-09-18 18:48:31.561336,0 days 00:00:09.835427,False,balanced,entropy,24.0,0.8,3,2,1470,COMPLETE
116,0.915016751804284,2025-09-18 18:48:31.582561,2025-09-18 18:48:41.982516,0 days 00:00:10.399955,False,balanced,entropy,24.0,0.8,4,5,1603,COMPLETE
117,0.898200379410318,2025-09-18 18:48:42.003883,2025-09-18 18:48:51.239627,0 days 00:00:09.235744,False,balanced,entropy,8.0,0.8,15,4,1543,COMPLETE
118,0.9160558789310068,2025-09-18 18:48:51.261370,2025-09-18 18:49:00.369456,0 days 00:00:09.108086,False,balanced,entropy,16.0,0.8,3,7,1364,COMPLETE
119,0.9181119800240743,2025-09-18 18:49:00.389889,2025-09-18 18:49:09.717896,0 days 00:00:09.328007,False,balanced,entropy,24.0,0.8,2,3,1394,COMPLETE
120,0.9180419393142148,2025-09-18 18:49:09.738478,2025-09-18 18:49:19.045702,0 days 00:00:09.307224,False,balanced,entropy,32.0,0.8,2,3,1395,COMPLETE
121,0.9180483184605238,2025-09-18 18:49:19.067514,2025-09-18 18:49:28.329873,0 days 00:00:09.262359,False,balanced,entropy,32.0,0.8,2,3,1385,COMPLETE
122,0.9180891110410767,2025-09-18 18:49:28.349513,2025-09-18 18:49:37.693024,0 days 00:00:09.343511,False,balanced,entropy,32.0,0.8,2,3,1388,COMPLETE
123,0.9169204199144328,2025-09-18 18:49:37.712738,2025-09-18 18:49:47.009623,0 days 00:00:09.296885,False,balanced,entropy,32.0,0.8,3,3,1404,COMPLETE
124,0.9179912065628717,2025-09-18 18:49:47.030156,2025-09-18 18:49:56.095330,0 days 00:00:09.065174,False,balanced,entropy,32.0,0.8,2,2,1344,COMPLETE
125,0.9181868511350124,2025-09-18 18:49:56.116167,2025-09-18 18:50:06.229212,0 days 00:00:10.113045,False,balanced,entropy,32.0,0.8,2,3,1492,COMPLETE
126,0.9168912294359801,2025-09-18 18:50:06.248634,2025-09-18 18:50:16.439287,0 days 00:00:10.190653,False,balanced,entropy,32.0,0.8,3,2,1511,COMPLETE
127,0.9149938997463076,2025-09-18 18:50:16.459462,2025-09-18 18:50:25.987242,0 days 00:00:09.527780,False,balanced,entropy,32.0,0.8,4,3,1445,COMPLETE
128,0.9180077042273826,2025-09-18 18:50:26.007382,2025-09-18 18:50:34.849426,0 days 00:00:08.842044,False,balanced,entropy,32.0,0.8,2,4,1311,COMPLETE
129,0.9142967246920923,2025-09-18 18:50:34.870703,2025-09-18 18:50:44.721075,0 days 00:00:09.850372,False,balanced,entropy,32.0,0.8,5,4,1538,COMPLETE
130,0.9229769678069064,2025-09-18 18:50:44.741986,2025-09-18 18:50:54.667948,0 days 00:00:09.925962,True,balanced,entropy,32.0,0.8,3,6,1688,PRUNED
131,0.918128081643087,2025-09-18 18:50:54.687752,2025-09-18 18:51:04.414256,0 days 00:00:09.726504,False,balanced,entropy,32.0,0.8,2,3,1406,COMPLETE
132,0.9181086394479955,2025-09-18 18:51:04.434162,2025-09-18 18:51:14.849128,0 days 00:00:10.414966,False,balanced,entropy,32.0,0.8,2,2,1562,COMPLETE
133,0.9181118395463976,2025-09-18 18:51:14.869819,2025-09-18 18:51:25.306394,0 days 00:00:10.436575,False,balanced,entropy,32.0,0.8,2,2,1559,COMPLETE
134,0.9181151752565329,2025-09-18 18:51:25.325711,2025-09-18 18:51:35.363227,0 days 00:00:10.037516,False,balanced,entropy,32.0,0.8,2,2,1470,COMPLETE
135,0.9169335805994321,2025-09-18 18:51:35.383428,2025-09-18 18:51:45.372820,0 days 00:00:09.989392,False,balanced,entropy,32.0,0.8,3,2,1489,COMPLETE
136,0.9181410722316222,2025-09-18 18:51:45.392074,2025-09-18 18:51:55.957348,0 days 00:00:10.565274,False,balanced,entropy,32.0,0.8,2,4,1578,COMPLETE
137,0.9182836881732808,2025-09-18 18:51:55.977006,2025-09-18 18:52:06.645956,0 days 00:00:10.668950,False,balanced,entropy,32.0,0.8,2,5,1589,COMPLETE
138,0.899157060209695,2025-09-18 18:52:06.666276,2025-09-18 18:52:16.012144,0 days 00:00:09.345868,False,balanced,entropy,32.0,log2,4,7,1712,COMPLETE
139,0.9117783349424269,2025-09-18 18:52:16.032915,2025-09-18 18:52:25.056549,0 days 00:00:09.023634,False,balanced,entropy,32.0,sqrt,3,5,1585,COMPLETE
140,0.9173370330160516,2025-09-18 18:52:25.077334,2025-09-18 18:52:35.919604,0 days 00:00:10.842270,False,balanced,entropy,32.0,0.8,2,6,1663,COMPLETE
141,0.9181216660022009,2025-09-18 18:52:35.940291,2025-09-18 18:52:45.402665,0 days 00:00:09.462374,False,balanced,entropy,32.0,0.8,2,4,1424,COMPLETE
142,0.9182027546254947,2025-09-18 18:52:45.423661,2025-09-18 18:52:56.209304,0 days 00:00:10.785643,False,balanced,entropy,32.0,0.8,2,4,1642,COMPLETE
143,0.9170117557918719,2025-09-18 18:52:56.230600,2025-09-18 18:53:06.934731,0 days 00:00:10.704131,False,balanced,entropy,32.0,0.8,3,4,1644,COMPLETE
144,0.9158979119950302,2025-09-18 18:53:06.956177,2025-09-18 18:53:18.848587,0 days 00:00:11.892410,False,balanced,entropy,32.0,0.8,2,9,1763,COMPLETE
145,0.9183554680348601,2025-09-18 18:53:18.868586,2025-09-18 18:53:29.041453,0 days 00:00:10.172867,False,balanced,entropy,32.0,0.8,2,5,1514,COMPLETE
146,0.9169109159860668,2025-09-18 18:53:29.062005,2025-09-18 18:53:39.409735,0 days 00:00:10.347730,False,balanced,entropy,,0.8,3,6,1589,COMPLETE
147,0.9173343223681092,2025-09-18 18:53:39.430619,2025-09-18 18:53:51.274363,0 days 00:00:11.843744,False,balanced,entropy,32.0,0.8,1,8,1785,COMPLETE
