number,value,datetime_start,datetime_complete,duration,params_bootstrap,params_class_weight,params_criterion,params_max_depth,params_max_features,params_min_samples_leaf,params_min_samples_split,params_n_estimators,state
0,0.8552176030418833,2025-09-11 13:26:21.964973,2025-09-11 13:27:21.003251,0 days 00:00:59.038278,False,balanced,entropy,24.0,1.0,9,49,1855,COMPLETE
1,0.8027631126523177,2025-09-11 13:26:21.969129,2025-09-11 13:26:45.319696,0 days 00:00:23.350567,True,balanced,gini,8.0,sqrt,19,15,598,COMPLETE
2,0.8555024461786174,2025-09-11 13:26:21.995390,2025-09-11 13:26:52.441056,0 days 00:00:30.445666,False,balanced,entropy,16.0,0.5,11,28,850,COMPLETE
3,0.849634517705069,2025-09-11 13:26:22.003626,2025-09-11 13:27:09.623112,0 days 00:00:47.619486,False,,gini,8.0,0.8,10,7,1418,COMPLETE
4,0.8111038393109705,2025-09-11 13:26:22.012510,2025-09-11 13:27:03.335571,0 days 00:00:41.323061,False,,gini,8.0,log2,9,4,1354,COMPLETE
5,0.8459233492442285,2025-09-11 13:26:46.581871,2025-09-11 13:27:28.977477,0 days 00:00:42.395606,False,balanced,gini,8.0,1.0,14,47,1323,COMPLETE
6,0.7588928954292953,2025-09-11 13:26:53.085985,2025-09-11 13:27:23.966887,0 days 00:00:30.880902,True,,gini,24.0,log2,20,35,1655,PRUNED
7,0.812964948185687,2025-09-11 13:27:03.495743,2025-09-11 13:27:23.657696,0 days 00:00:20.161953,False,,gini,8.0,log2,4,41,1572,PRUNED
8,0.7938472533541241,2025-09-11 13:27:10.420250,2025-09-11 13:27:28.962955,0 days 00:00:18.542705,True,balanced,entropy,16.0,log2,16,27,1452,PRUNED
9,0.8698512293801276,2025-09-11 13:27:22.878959,2025-09-11 13:28:04.682887,0 days 00:00:41.803928,False,,entropy,16.0,1.0,7,17,1372,COMPLETE
10,0.789840442852491,2025-09-11 13:27:23.780118,2025-09-11 13:27:29.673093,0 days 00:00:05.892975,True,balanced,entropy,32.0,log2,17,30,982,PRUNED
11,0.8312438944969066,2025-09-11 13:27:24.282999,2025-09-11 13:27:33.140033,0 days 00:00:08.857034,True,balanced,gini,24.0,0.8,20,16,1470,PRUNED
12,0.7985183979159882,2025-09-11 13:27:29.098136,2025-09-11 13:27:32.278806,0 days 00:00:03.180670,True,balanced,entropy,12.0,sqrt,19,13,317,PRUNED
13,0.7946597199609248,2025-09-11 13:27:29.135643,2025-09-11 13:27:37.709448,0 days 00:00:08.573805,True,balanced,entropy,16.0,log2,14,31,1340,PRUNED
14,0.8693315341189443,2025-09-11 13:27:30.825520,2025-09-11 13:27:45.060461,0 days 00:00:14.234941,False,balanced,entropy,16.0,0.5,1,19,307,COMPLETE
15,0.8540835472788253,2025-09-11 13:27:32.969965,2025-09-11 13:28:01.915387,0 days 00:00:28.945422,False,balanced,entropy,,0.5,5,49,900,COMPLETE
16,0.8531376687685108,2025-09-11 13:27:33.473560,2025-09-11 13:28:22.572218,0 days 00:00:49.098658,False,balanced,entropy,16.0,0.5,6,48,1959,COMPLETE
17,0.8954455381216905,2025-09-11 13:27:38.124743,2025-09-11 13:28:17.790810,0 days 00:00:39.666067,False,balanced,entropy,,0.5,6,48,1915,PRUNED
18,0.8671391419646775,2025-09-11 13:27:46.733388,2025-09-11 13:28:12.668702,0 days 00:00:25.935314,False,balanced,entropy,16.0,0.5,3,21,833,COMPLETE
19,0.8670165339369473,2025-09-11 13:28:02.784832,2025-09-11 13:28:12.682118,0 days 00:00:09.897286,False,balanced,entropy,16.0,0.5,1,22,204,COMPLETE
20,0.8696449517691371,2025-09-11 13:28:05.358005,2025-09-11 13:28:17.479584,0 days 00:00:12.121579,False,,entropy,16.0,0.5,1,21,226,COMPLETE
21,0.8734712508890793,2025-09-11 13:28:13.012451,2025-09-11 13:28:43.860248,0 days 00:00:30.847797,False,,entropy,,1.0,6,10,1146,COMPLETE
22,0.8742787905163987,2025-09-11 13:28:13.053486,2025-09-11 13:28:30.451070,0 days 00:00:17.397584,False,,entropy,,1.0,6,10,519,COMPLETE
23,0.8698127223121382,2025-09-11 13:28:17.685421,2025-09-11 13:28:38.574535,0 days 00:00:20.889114,False,,entropy,12.0,1.0,6,9,641,COMPLETE
24,0.8682525394698637,2025-09-11 13:28:18.130041,2025-09-11 13:28:45.141055,0 days 00:00:27.011014,False,,entropy,12.0,1.0,7,10,1089,COMPLETE
25,0.8728604442185517,2025-09-11 13:28:22.857432,2025-09-11 13:28:38.133207,0 days 00:00:15.275775,False,,entropy,16.0,1.0,1,21,425,COMPLETE
26,0.8717429014583052,2025-09-11 13:28:31.914725,2025-09-11 13:28:48.748729,0 days 00:00:16.834004,False,,entropy,,1.0,7,10,523,COMPLETE
27,0.8718273649308461,2025-09-11 13:28:38.506019,2025-09-11 13:28:58.372608,0 days 00:00:19.866589,False,,entropy,,1.0,7,10,639,COMPLETE
28,0.9039567293636098,2025-09-11 13:28:39.161385,2025-09-11 13:28:52.117393,0 days 00:00:12.956008,False,,entropy,,1.0,8,11,504,PRUNED
29,0.8781206856203422,2025-09-11 13:28:44.468396,2025-09-11 13:29:17.252919,0 days 00:00:32.784523,False,,entropy,,1.0,4,11,1154,COMPLETE
30,0.8806974184571779,2025-09-11 13:28:46.966105,2025-09-11 13:29:03.711925,0 days 00:00:16.745820,False,,entropy,,1.0,3,5,558,COMPLETE
31,0.8805002142972149,2025-09-11 13:28:49.403498,2025-09-11 13:29:07.864595,0 days 00:00:18.461097,False,,entropy,,1.0,3,2,457,COMPLETE
32,0.8804688399092171,2025-09-11 13:28:52.808853,2025-09-11 13:29:25.897590,0 days 00:00:33.088737,False,,entropy,,1.0,3,3,1175,COMPLETE
33,0.8804624197197317,2025-09-11 13:28:59.049002,2025-09-11 13:29:32.547424,0 days 00:00:33.498422,False,,entropy,32.0,1.0,3,4,1182,COMPLETE
34,0.8805028640679714,2025-09-11 13:29:04.334413,2025-09-11 13:29:26.228375,0 days 00:00:21.893962,False,,entropy,,1.0,3,2,752,COMPLETE
35,0.8805597455737709,2025-09-11 13:29:08.466771,2025-09-11 13:29:31.636637,0 days 00:00:23.169866,False,,entropy,,1.0,3,2,742,COMPLETE
36,0.8804313627287739,2025-09-11 13:29:17.454087,2025-09-11 13:29:39.204267,0 days 00:00:21.750180,False,,entropy,,1.0,3,2,734,COMPLETE
37,0.8593943340931293,2025-09-11 13:29:26.066205,2025-09-11 13:29:32.723843,0 days 00:00:06.657638,False,,entropy,,sqrt,3,2,1197,PRUNED
38,0.8603386519049169,2025-09-11 13:29:27.132213,2025-09-11 13:29:32.015408,0 days 00:00:04.883195,False,,entropy,,sqrt,3,2,683,PRUNED
39,0.860371214588082,2025-09-11 13:29:31.955295,2025-09-11 13:29:36.395884,0 days 00:00:04.440589,False,,entropy,32.0,sqrt,3,5,778,PRUNED
40,0.8789024876322259,2025-09-11 13:29:32.246788,2025-09-11 13:29:55.911339,0 days 00:00:23.664551,False,,gini,,0.8,2,6,763,COMPLETE
41,0.8547378704005211,2025-09-11 13:29:33.559523,2025-09-11 13:29:38.684757,0 days 00:00:05.125234,False,,gini,,0.8,11,7,742,PRUNED
42,0.8548844024747639,2025-09-11 13:29:33.834442,2025-09-11 13:29:38.726893,0 days 00:00:04.892451,False,,gini,,0.8,11,7,783,PRUNED
43,0.8568544448062521,2025-09-11 13:29:36.655585,2025-09-11 13:29:39.549453,0 days 00:00:02.893868,False,,gini,,0.8,10,6,727,PRUNED
44,0.8809257273683929,2025-09-11 13:29:38.947754,2025-09-11 13:29:56.102195,0 days 00:00:17.154441,False,,entropy,,1.0,2,6,405,COMPLETE
45,0.8824687327949885,2025-09-11 13:29:38.985612,2025-09-11 13:30:07.884592,0 days 00:00:28.898980,False,,entropy,,1.0,2,2,947,COMPLETE
46,0.8748590425517566,2025-09-11 13:29:39.386269,2025-09-11 13:30:07.870388,0 days 00:00:28.484119,True,,entropy,24.0,1.0,2,4,953,COMPLETE
47,0.8743600199347131,2025-09-11 13:29:40.548842,2025-09-11 13:29:56.442548,0 days 00:00:15.893706,True,,entropy,24.0,1.0,2,4,429,COMPLETE
48,0.8657603386519049,2025-09-11 13:29:56.166341,2025-09-11 13:30:01.758352,0 days 00:00:05.592011,True,,entropy,24.0,1.0,4,4,427,PRUNED
49,0.8478345815695214,2025-09-11 13:29:56.446043,2025-09-11 13:30:02.143420,0 days 00:00:05.697377,True,,entropy,8.0,1.0,4,15,573,PRUNED
50,0.8475415174210356,2025-09-11 13:29:57.634608,2025-09-11 13:30:05.018276,0 days 00:00:07.383668,True,,entropy,8.0,1.0,4,15,941,PRUNED
51,0.9072377611019069,2025-09-11 13:30:01.941251,2025-09-11 13:30:24.222307,0 days 00:00:22.281056,False,,entropy,,1.0,5,14,949,PRUNED
52,0.8572940410289808,2025-09-11 13:30:03.016528,2025-09-11 13:30:08.385744,0 days 00:00:05.369216,False,,entropy,,1.0,5,42,958,PRUNED
53,0.8502279387821555,2025-09-11 13:30:05.606128,2025-09-11 13:30:07.625424,0 days 00:00:02.019296,False,,entropy,,1.0,13,43,362,PRUNED
54,0.8763256110913812,2025-09-11 13:30:07.988781,2025-09-11 13:30:32.253474,0 days 00:00:24.264693,False,,entropy,,1.0,5,8,842,COMPLETE
55,0.8812382148828842,2025-09-11 13:30:08.173138,2025-09-11 13:30:34.791684,0 days 00:00:26.618546,False,,entropy,,1.0,2,7,860,COMPLETE
56,0.8815406352889253,2025-09-11 13:30:08.266882,2025-09-11 13:30:35.636948,0 days 00:00:27.370066,False,,entropy,,1.0,2,8,881,COMPLETE
57,0.8337837837837838,2025-09-11 13:30:09.025078,2025-09-11 13:30:16.217132,0 days 00:00:07.192054,False,,entropy,,log2,5,8,1045,PRUNED
58,0.8814339355118396,2025-09-11 13:30:16.921575,2025-09-11 13:30:41.249352,0 days 00:00:24.327777,False,,entropy,,1.0,2,6,871,COMPLETE
59,0.8615434711820255,2025-09-11 13:30:24.980757,2025-09-11 13:30:30.681271,0 days 00:00:05.700514,False,,entropy,,1.0,2,35,855,PRUNED
60,0.8813088810251714,2025-09-11 13:30:31.033807,2025-09-11 13:30:50.487368,0 days 00:00:19.453561,False,,entropy,32.0,1.0,2,6,584,COMPLETE
61,0.8754215429900883,2025-09-11 13:30:33.196269,2025-09-11 13:31:17.912114,0 days 00:00:44.715845,False,,entropy,12.0,1.0,2,6,1772,COMPLETE
62,0.8333604689026375,2025-09-11 13:30:35.246750,2025-09-11 13:30:41.235810,0 days 00:00:05.989060,False,,gini,12.0,log2,1,13,1034,PRUNED
63,0.8525398892868772,2025-09-11 13:30:36.599839,2025-09-11 13:30:41.322678,0 days 00:00:04.722839,False,,gini,32.0,log2,1,13,1039,PRUNED
64,0.8813052880018217,2025-09-11 13:30:41.367434,2025-09-11 13:31:02.714807,0 days 00:00:21.347373,False,,entropy,,1.0,2,6,569,COMPLETE
65,0.8815317198223935,2025-09-11 13:30:41.448540,2025-09-11 13:31:09.914679,0 days 00:00:28.466139,False,,entropy,,1.0,2,6,886,COMPLETE
66,0.8814176674987113,2025-09-11 13:30:41.830715,2025-09-11 13:31:07.943644,0 days 00:00:26.112929,False,,entropy,,1.0,2,6,873,COMPLETE
67,0.8817414410405299,2025-09-11 13:30:50.699074,2025-09-11 13:31:10.007972,0 days 00:00:19.308898,False,,entropy,32.0,1.0,2,8,581,COMPLETE
68,0.8705796157603387,2025-09-11 13:31:03.227085,2025-09-11 13:31:07.602593,0 days 00:00:04.375508,False,,entropy,32.0,1.0,2,24,616,PRUNED
69,0.8799434075947203,2025-09-11 13:31:07.905450,2025-09-11 13:31:36.203991,0 days 00:00:28.298541,False,balanced,entropy,32.0,1.0,2,8,880,COMPLETE
70,0.8780177109346627,2025-09-11 13:31:08.574030,2025-09-11 13:31:36.435506,0 days 00:00:27.861476,False,balanced,entropy,32.0,1.0,1,12,869,COMPLETE
71,0.8779823050594823,2025-09-11 13:31:11.133048,2025-09-11 13:31:46.832433,0 days 00:00:35.699385,False,balanced,entropy,32.0,1.0,1,12,1284,COMPLETE
72,0.8692119830674049,2025-09-11 13:31:11.463245,2025-09-11 13:31:18.367582,0 days 00:00:06.904337,False,balanced,entropy,32.0,1.0,1,18,1257,PRUNED
73,0.8698143927059588,2025-09-11 13:31:18.294333,2025-09-11 13:31:24.873355,0 days 00:00:06.579022,False,balanced,entropy,32.0,1.0,1,17,882,PRUNED
74,0.8709866492999023,2025-09-11 13:31:19.162552,2025-09-11 13:31:26.863422,0 days 00:00:07.700870,False,balanced,entropy,32.0,0.5,1,12,914,PRUNED
75,0.8772091771739051,2025-09-11 13:31:25.144277,2025-09-11 13:31:47.426789,0 days 00:00:22.282512,False,,entropy,32.0,1.0,4,12,682,COMPLETE
76,0.8777275918456644,2025-09-11 13:31:27.978237,2025-09-11 13:31:51.927618,0 days 00:00:23.949381,False,,entropy,32.0,1.0,4,9,816,COMPLETE
77,0.8512699446434389,2025-09-11 13:31:36.505932,2025-09-11 13:31:40.629924,0 days 00:00:04.123992,False,,entropy,8.0,1.0,4,9,677,PRUNED
78,0.851579290133507,2025-09-11 13:31:36.803864,2025-09-11 13:31:41.244511,0 days 00:00:04.440647,False,,entropy,8.0,1.0,4,9,665,PRUNED
79,0.81489742754803,2025-09-11 13:31:41.663406,2025-09-11 13:31:47.282019,0 days 00:00:05.618613,False,,entropy,32.0,sqrt,16,5,1094,PRUNED
80,0.8551611852816672,2025-09-11 13:31:41.880985,2025-09-11 13:31:47.367813,0 days 00:00:05.486828,False,,entropy,32.0,1.0,13,5,1102,PRUNED
81,0.8824478325622028,2025-09-11 13:31:46.979964,2025-09-11 13:32:04.579745,0 days 00:00:17.599781,False,,entropy,,1.0,2,3,495,COMPLETE
82,0.8826732936270218,2025-09-11 13:31:47.449495,2025-09-11 13:32:13.252087,0 days 00:00:25.802592,False,,entropy,,1.0,2,3,801,COMPLETE
83,0.8814131569805351,2025-09-11 13:31:47.716233,2025-09-11 13:32:16.092719,0 days 00:00:28.376486,False,,entropy,,1.0,2,8,1006,COMPLETE
84,0.9088620342396778,2025-09-11 13:31:48.287958,2025-09-11 13:31:58.057561,0 days 00:00:09.769603,False,,entropy,,1.0,2,3,258,PRUNED
85,0.8817097700944247,2025-09-11 13:31:52.543187,2025-09-11 13:32:20.051113,0 days 00:00:27.507926,False,,entropy,,1.0,2,7,1012,COMPLETE
86,0.8810857642344745,2025-09-11 13:31:59.129295,2025-09-11 13:32:14.588121,0 days 00:00:15.458826,False,,entropy,,1.0,2,7,482,COMPLETE
87,0.8825326648415359,2025-09-11 13:32:04.996314,2025-09-11 13:32:21.223244,0 days 00:00:16.226930,False,,entropy,,1.0,2,3,483,COMPLETE
88,0.9091056752103434,2025-09-11 13:32:13.999207,2025-09-11 13:32:26.020805,0 days 00:00:12.021598,False,,entropy,,1.0,3,3,487,PRUNED
89,0.8803400539842595,2025-09-11 13:32:15.694725,2025-09-11 13:32:40.942745,0 days 00:00:25.248020,False,,entropy,,1.0,3,3,807,COMPLETE
90,0.885894812071598,2025-09-11 13:32:16.669839,2025-09-11 13:32:26.936314,0 days 00:00:10.266475,False,,entropy,,0.5,3,3,1004,PRUNED
91,0.8852938310106228,2025-09-11 13:32:20.307806,2025-09-11 13:32:29.752737,0 days 00:00:09.444931,False,,entropy,,0.5,3,3,791,PRUNED
92,0.8663139042657115,2025-09-11 13:32:22.701269,2025-09-11 13:32:25.916594,0 days 00:00:03.215325,True,,entropy,,0.5,3,3,360,PRUNED
93,0.8836465763384627,2025-09-11 13:32:26.893389,2025-09-11 13:32:51.940122,0 days 00:00:25.046733,False,,entropy,,1.0,1,4,809,COMPLETE
94,0.8837361897776403,2025-09-11 13:32:26.944683,2025-09-11 13:32:51.688518,0 days 00:00:24.743835,False,,entropy,,1.0,1,4,799,COMPLETE
95,0.8836498497962539,2025-09-11 13:32:27.068914,2025-09-11 13:32:51.876959,0 days 00:00:24.808045,False,,entropy,,1.0,1,4,810,COMPLETE
96,0.8836259673747154,2025-09-11 13:32:30.230442,2025-09-11 13:32:56.677192,0 days 00:00:26.446750,False,,entropy,,1.0,1,5,923,COMPLETE
97,0.8840760053306624,2025-09-11 13:32:41.090736,2025-09-11 13:33:01.224103,0 days 00:00:20.133367,False,,entropy,,0.8,1,4,915,COMPLETE
98,0.8810866634820125,2025-09-11 13:32:51.840224,2025-09-11 13:33:03.579286,0 days 00:00:11.739062,False,,entropy,16.0,0.8,1,4,909,COMPLETE
99,0.8868693759542605,2025-09-11 13:32:52.028767,2025-09-11 13:32:58.855607,0 days 00:00:06.826840,False,,gini,16.0,0.8,1,4,533,PRUNED
