number,value,datetime_start,datetime_complete,duration,params_bootstrap,params_class_weight,params_criterion,params_max_depth,params_max_features,params_min_samples_leaf,params_min_samples_split,params_n_estimators,state
0,0.8303255575493464,2025-09-12 16:34:33.734926,2025-09-12 16:35:28.111038,0 days 00:00:54.376112,False,balanced,gini,12.0,sqrt,16,24,1772,COMPLETE
1,0.8261311202255832,2025-09-12 16:34:33.744322,2025-09-12 16:34:54.226077,0 days 00:00:20.481755,True,,gini,32.0,log2,7,40,361,COMPLETE
2,0.8662105870289668,2025-09-12 16:34:33.736644,2025-09-12 16:35:28.487890,0 days 00:00:54.751246,False,,entropy,32.0,0.8,12,2,1750,COMPLETE
3,0.8625897205844655,2025-09-12 16:34:33.770903,2025-09-12 16:35:28.367098,0 days 00:00:54.596195,True,,gini,16.0,1.0,4,33,1601,COMPLETE
4,0.816088823378621,2025-09-12 16:34:33.790715,2025-09-12 16:35:15.352544,0 days 00:00:41.561829,False,,gini,16.0,log2,18,45,1228,COMPLETE
5,0.8625897205844655,2025-09-12 16:34:54.433116,2025-09-12 16:35:28.633755,0 days 00:00:34.200639,True,,gini,,0.8,10,15,880,COMPLETE
6,0.8374775698538837,2025-09-12 16:35:15.581723,2025-09-12 16:35:35.332327,0 days 00:00:19.750604,True,balanced,gini,24.0,log2,11,21,944,PRUNED
7,0.8040085875416559,2025-09-12 16:35:28.274762,2025-09-12 16:35:34.574408,0 days 00:00:06.299646,True,,gini,12.0,log2,17,13,759,PRUNED
8,0.8842924891053575,2025-09-12 16:35:28.520021,2025-09-12 16:35:48.500785,0 days 00:00:19.980764,False,balanced,entropy,24.0,sqrt,3,21,975,PRUNED
9,0.8721417585234554,2025-09-12 16:35:29.550869,2025-09-12 16:35:48.239710,0 days 00:00:18.688841,False,balanced,entropy,32.0,sqrt,2,8,367,COMPLETE
10,0.8037522430146118,2025-09-12 16:35:30.423847,2025-09-12 16:35:41.315284,0 days 00:00:10.891437,False,balanced,gini,8.0,log2,13,44,1984,PRUNED
11,0.8430530633170981,2025-09-12 16:35:34.828354,2025-09-12 16:35:51.158813,0 days 00:00:16.330459,True,,entropy,16.0,0.5,16,36,1450,PRUNED
12,0.8641726480389643,2025-09-12 16:35:35.933904,2025-09-12 16:36:03.059872,0 days 00:00:27.125968,False,,entropy,12.0,0.8,4,44,1060,COMPLETE
13,0.8258299154063062,2025-09-12 16:35:41.952055,2025-09-12 16:35:50.655805,0 days 00:00:08.703750,True,balanced,entropy,12.0,sqrt,2,28,1396,PRUNED
14,0.8790935016662393,2025-09-12 16:35:48.433597,2025-09-12 16:35:56.027319,0 days 00:00:07.593722,False,balanced,entropy,32.0,sqrt,1,2,200,COMPLETE
15,0.8858674057933863,2025-09-12 16:35:48.641035,2025-09-12 16:35:58.839923,0 days 00:00:10.198888,False,balanced,entropy,32.0,0.5,1,2,314,COMPLETE
16,0.8722539092540373,2025-09-12 16:35:51.290849,2025-09-12 16:36:02.368619,0 days 00:00:11.077770,False,balanced,entropy,32.0,0.8,7,2,362,COMPLETE
17,0.8721577800563958,2025-09-12 16:35:51.487037,2025-09-12 16:35:59.442010,0 days 00:00:07.954973,False,balanced,entropy,32.0,0.8,7,2,209,COMPLETE
18,0.8789204691104846,2025-09-12 16:35:56.272895,2025-09-12 16:36:04.232608,0 days 00:00:07.959713,False,balanced,entropy,32.0,sqrt,1,2,217,COMPLETE
19,0.8720135862599333,2025-09-12 16:35:59.294956,2025-09-12 16:36:08.504964,0 days 00:00:09.210008,False,balanced,entropy,32.0,0.5,6,3,205,COMPLETE
20,0.8778165854908997,2025-09-12 16:36:00.711528,2025-09-12 16:36:17.274852,0 days 00:00:16.563324,False,balanced,entropy,32.0,0.5,5,9,602,COMPLETE
21,0.877534606511151,2025-09-12 16:36:02.649932,2025-09-12 16:36:20.642334,0 days 00:00:17.992402,False,balanced,entropy,,0.5,5,10,645,COMPLETE
22,0.8344655216611125,2025-09-12 16:36:03.959702,2025-09-12 16:36:08.459698,0 days 00:00:04.499996,False,balanced,entropy,,0.5,20,10,648,PRUNED
23,0.8350903614457831,2025-09-12 16:36:04.825180,2025-09-12 16:36:08.663137,0 days 00:00:03.837957,False,balanced,entropy,8.0,0.5,6,10,629,PRUNED
24,0.8776948218405538,2025-09-12 16:36:08.588117,2025-09-12 16:36:23.678178,0 days 00:00:15.090061,False,balanced,entropy,32.0,sqrt,1,6,502,COMPLETE
25,0.8776723916944373,2025-09-12 16:36:08.614224,2025-09-12 16:36:23.712459,0 days 00:00:15.098235,False,balanced,entropy,32.0,sqrt,1,6,506,COMPLETE
26,0.8757433991284286,2025-09-12 16:36:08.731514,2025-09-12 16:36:24.168069,0 days 00:00:15.436555,False,balanced,entropy,32.0,sqrt,1,7,516,COMPLETE
27,0.8452480133299154,2025-09-12 16:36:18.508342,2025-09-12 16:36:22.049697,0 days 00:00:03.541355,False,balanced,entropy,32.0,sqrt,1,16,454,PRUNED
28,0.8439182260958729,2025-09-12 16:36:21.156799,2025-09-12 16:36:24.079938,0 days 00:00:02.923139,False,balanced,entropy,32.0,sqrt,1,17,470,PRUNED
29,0.8847186618815688,2025-09-12 16:36:22.537393,2025-09-12 16:36:35.501117,0 days 00:00:12.963724,False,balanced,entropy,32.0,1.0,1,6,473,COMPLETE
30,0.8361638041527814,2025-09-12 16:36:24.022352,2025-09-12 16:36:26.619090,0 days 00:00:02.596738,False,balanced,entropy,8.0,1.0,3,13,272,PRUNED
31,0.8386631632914637,2025-09-12 16:36:24.049632,2025-09-12 16:36:26.547885,0 days 00:00:02.498253,False,balanced,entropy,8.0,1.0,9,5,210,PRUNED
32,0.8367726224045117,2025-09-12 16:36:24.277686,2025-09-12 16:36:26.704213,0 days 00:00:02.426527,False,balanced,entropy,8.0,1.0,9,26,286,PRUNED
33,0.8361317610869008,2025-09-12 16:36:24.536769,2025-09-12 16:36:26.969831,0 days 00:00:02.433062,False,balanced,entropy,8.0,1.0,3,29,268,PRUNED
34,0.8808766982824917,2025-09-12 16:36:26.656033,2025-09-12 16:36:38.420214,0 days 00:00:11.764181,False,balanced,entropy,32.0,0.5,3,5,328,COMPLETE
35,0.8797776211227891,2025-09-12 16:36:26.929422,2025-09-12 16:36:40.370500,0 days 00:00:13.441078,False,balanced,entropy,32.0,0.5,4,4,362,COMPLETE
36,0.8801012560881825,2025-09-12 16:36:27.043187,2025-09-12 16:36:47.095360,0 days 00:00:20.052173,False,balanced,entropy,32.0,0.5,4,4,803,COMPLETE
37,0.8796462445526787,2025-09-12 16:36:27.548493,2025-09-12 16:36:41.404301,0 days 00:00:13.855808,False,balanced,entropy,32.0,0.5,4,4,386,COMPLETE
38,0.839207895411433,2025-09-12 16:36:35.614664,2025-09-12 16:36:39.447909,0 days 00:00:03.833245,False,balanced,entropy,32.0,1.0,3,49,355,PRUNED
39,0.8800724173288901,2025-09-12 16:36:38.616992,2025-09-12 16:37:01.576859,0 days 00:00:22.959867,False,balanced,entropy,32.0,0.5,4,5,792,COMPLETE
40,0.8784318123558063,2025-09-12 16:36:39.831653,2025-09-12 16:36:55.159775,0 days 00:00:15.328122,False,balanced,gini,24.0,0.5,4,4,392,COMPLETE
41,0.8442386567546782,2025-09-12 16:36:41.529216,2025-09-12 16:36:47.134524,0 days 00:00:05.605308,True,,gini,24.0,0.5,5,13,774,PRUNED
42,0.8437419892335299,2025-09-12 16:36:41.636068,2025-09-12 16:36:47.253495,0 days 00:00:05.617427,True,,gini,24.0,0.5,5,12,777,PRUNED
43,0.8833984875672904,2025-09-12 16:36:47.917405,2025-09-12 16:37:09.847330,0 days 00:00:21.929925,False,balanced,entropy,16.0,0.5,2,5,577,COMPLETE
44,0.8843661881568827,2025-09-12 16:36:48.027281,2025-09-12 16:37:22.151894,0 days 00:00:34.124613,False,balanced,entropy,16.0,0.5,2,5,1176,COMPLETE
45,0.8841611125352473,2025-09-12 16:36:48.174292,2025-09-12 16:37:15.242994,0 days 00:00:27.068702,False,balanced,entropy,16.0,0.5,2,5,858,COMPLETE
46,0.8815560112791591,2025-09-12 16:36:56.049383,2025-09-12 16:37:22.033537,0 days 00:00:25.984154,False,balanced,entropy,16.0,0.5,2,7,858,COMPLETE
47,0.8813957959497565,2025-09-12 16:37:02.424404,2025-09-12 16:37:37.492463,0 days 00:00:35.068059,False,balanced,entropy,16.0,0.5,2,7,1236,COMPLETE
48,0.8479876954627018,2025-09-12 16:37:10.802126,2025-09-12 16:37:15.315983,0 days 00:00:04.513857,False,balanced,entropy,16.0,0.5,2,20,550,PRUNED
49,0.8061394514227121,2025-09-12 16:37:15.373032,2025-09-12 16:37:22.273360,0 days 00:00:06.900328,True,,entropy,16.0,log2,14,8,927,PRUNED
50,0.8060112791591899,2025-09-12 16:37:15.616336,2025-09-12 16:37:22.235369,0 days 00:00:06.619033,True,,entropy,16.0,log2,14,8,891,PRUNED
51,0.808783004357857,2025-09-12 16:37:22.166397,2025-09-12 16:37:30.933750,0 days 00:00:08.767353,True,,gini,16.0,log2,12,18,1145,PRUNED
52,0.8341130479364266,2025-09-12 16:37:22.258666,2025-09-12 16:37:31.041499,0 days 00:00:08.782833,True,,gini,16.0,1.0,2,37,1184,PRUNED
53,0.8504389900025633,2025-09-12 16:37:22.629315,2025-09-12 16:37:32.239519,0 days 00:00:09.610204,False,balanced,gini,16.0,1.0,2,12,1202,PRUNED
54,0.8467219943604205,2025-09-12 16:37:22.953474,2025-09-12 16:37:32.223664,0 days 00:00:09.270190,False,balanced,gini,16.0,1.0,2,18,1199,PRUNED
55,0.905777364778262,2025-09-12 16:37:31.618537,2025-09-12 16:37:52.021135,0 days 00:00:20.402598,False,balanced,entropy,16.0,0.5,2,12,1053,PRUNED
56,0.8810593437580106,2025-09-12 16:37:31.836876,2025-09-12 16:38:04.610956,0 days 00:00:32.774080,False,balanced,entropy,16.0,0.5,2,7,1024,COMPLETE
57,0.8816072801845681,2025-09-12 16:37:32.383589,2025-09-12 16:38:06.369735,0 days 00:00:33.986146,False,balanced,entropy,16.0,0.5,2,8,1041,COMPLETE
58,0.8811426557293001,2025-09-12 16:37:32.609621,2025-09-12 16:38:05.814017,0 days 00:00:33.204396,False,balanced,entropy,16.0,0.5,2,7,1058,COMPLETE
59,0.9053287618559344,2025-09-12 16:37:37.672950,2025-09-12 16:37:57.943762,0 days 00:00:20.270812,False,balanced,entropy,16.0,0.5,3,11,1023,PRUNED
60,0.8821744424506537,2025-09-12 16:37:54.072049,2025-09-12 16:38:34.838096,0 days 00:00:40.766047,False,balanced,entropy,16.0,0.8,3,2,1298,COMPLETE
61,0.8464496283004357,2025-09-12 16:37:58.163543,2025-09-12 16:38:06.589038,0 days 00:00:08.425495,False,balanced,entropy,12.0,0.8,6,15,1361,PRUNED
62,0.8482600615226866,2025-09-12 16:38:05.258709,2025-09-12 16:38:09.903392,0 days 00:00:04.644683,False,balanced,entropy,12.0,0.8,6,2,723,PRUNED
63,0.8466258651627788,2025-09-12 16:38:06.245607,2025-09-12 16:38:13.050068,0 days 00:00:06.804461,False,balanced,entropy,12.0,0.8,6,15,711,PRUNED
64,0.8806652140476802,2025-09-12 16:38:07.005332,2025-09-12 16:38:29.405909,0 days 00:00:22.400577,False,balanced,entropy,16.0,0.5,3,2,689,COMPLETE
65,0.90742758267111,2025-09-12 16:38:07.083837,2025-09-12 16:38:20.959649,0 days 00:00:13.875812,False,balanced,entropy,16.0,0.5,3,2,693,PRUNED
66,0.8817995385798513,2025-09-12 16:38:10.392335,2025-09-12 16:38:37.130119,0 days 00:00:26.737784,False,balanced,entropy,,0.5,1,9,848,COMPLETE
67,0.8818315816457319,2025-09-12 16:38:14.109186,2025-09-12 16:38:59.316465,0 days 00:00:45.207279,False,balanced,entropy,,0.5,1,9,1643,COMPLETE
68,0.8817386567546782,2025-09-12 16:38:21.533129,2025-09-12 16:38:49.741384,0 days 00:00:28.208255,False,balanced,entropy,,0.5,1,9,874,COMPLETE
69,0.8821520123045372,2025-09-12 16:38:30.218795,2025-09-12 16:39:08.157501,0 days 00:00:37.938706,False,balanced,entropy,,0.5,1,9,1282,COMPLETE
70,0.8826647013586261,2025-09-12 16:38:35.892188,2025-09-12 16:39:18.120393,0 days 00:00:42.228205,False,balanced,entropy,,0.8,1,9,1332,COMPLETE
71,0.8826358625993335,2025-09-12 16:38:38.236833,2025-09-12 16:39:24.203708,0 days 00:00:45.966875,False,balanced,entropy,,0.8,1,9,1339,COMPLETE
72,0.884555242245578,2025-09-12 16:38:51.327993,2025-09-12 16:39:38.699241,0 days 00:00:47.371248,False,balanced,entropy,16.0,0.8,1,5,1587,COMPLETE
73,0.8858145347346834,2025-09-12 16:38:59.675905,2025-09-12 16:39:53.781187,0 days 00:00:54.105282,False,balanced,entropy,,0.8,1,4,1650,COMPLETE
74,0.8845424250192258,2025-09-12 16:39:08.693872,2025-09-12 16:39:51.153358,0 days 00:00:42.459486,False,balanced,entropy,,0.8,1,5,1293,COMPLETE
75,0.8845872853114587,2025-09-12 16:39:18.345667,2025-09-12 16:40:00.743274,0 days 00:00:42.397607,False,balanced,entropy,,0.8,1,5,1324,COMPLETE
76,0.8848179953857984,2025-09-12 16:39:24.709949,2025-09-12 16:40:10.988391,0 days 00:00:46.278442,False,balanced,entropy,,0.8,1,5,1527,COMPLETE
77,0.8848596513714433,2025-09-12 16:39:40.020223,2025-09-12 16:40:29.163635,0 days 00:00:49.143412,False,balanced,entropy,,0.8,1,5,1530,COMPLETE
78,0.8849333504229685,2025-09-12 16:39:51.630885,2025-09-12 16:40:45.566202,0 days 00:00:53.935317,False,balanced,entropy,,0.8,1,5,1583,COMPLETE
79,0.8346898231222764,2025-09-12 16:39:55.556492,2025-09-12 16:40:07.915044,0 days 00:00:12.358552,False,balanced,entropy,,0.8,20,5,1851,PRUNED
80,0.8842284029735966,2025-09-12 16:40:01.247489,2025-09-12 16:40:48.179530,0 days 00:00:46.932041,False,balanced,entropy,,0.8,1,6,1455,COMPLETE
81,0.8867037298128684,2025-09-12 16:40:08.344815,2025-09-12 16:40:56.160496,0 days 00:00:47.815681,False,balanced,entropy,,0.8,1,3,1481,COMPLETE
82,0.8867614073314535,2025-09-12 16:40:12.454684,2025-09-12 16:41:03.022786,0 days 00:00:50.568102,False,balanced,entropy,,0.8,1,3,1553,COMPLETE
83,0.8866925147398103,2025-09-12 16:40:29.740814,2025-09-12 16:41:18.602144,0 days 00:00:48.861330,False,balanced,entropy,,0.8,1,3,1512,COMPLETE
84,0.8865995898487566,2025-09-12 16:40:46.079938,2025-09-12 16:41:34.287049,0 days 00:00:48.207111,False,balanced,entropy,,0.8,1,3,1514,COMPLETE
85,0.8866380415278133,2025-09-12 16:40:49.573413,2025-09-12 16:41:40.755275,0 days 00:00:51.181862,False,balanced,entropy,,0.8,1,3,1568,COMPLETE
86,0.886734170725455,2025-09-12 16:40:56.326127,2025-09-12 16:41:44.726365,0 days 00:00:48.400238,False,balanced,entropy,,0.8,1,3,1535,COMPLETE
87,0.8352826198410664,2025-09-12 16:41:03.494792,2025-09-12 16:41:13.017929,0 days 00:00:09.523137,False,balanced,entropy,,0.8,18,3,1528,PRUNED
88,0.8829242501922584,2025-09-12 16:41:13.349959,2025-09-12 16:42:06.940048,0 days 00:00:53.590089,False,balanced,entropy,,0.8,3,3,1703,COMPLETE
89,0.8829627018713151,2025-09-12 16:41:19.457354,2025-09-12 16:42:13.012510,0 days 00:00:53.555156,False,balanced,entropy,,0.8,3,3,1714,COMPLETE
90,0.8829306588054345,2025-09-12 16:41:34.508127,2025-09-12 16:42:26.234205,0 days 00:00:51.726078,False,balanced,entropy,,0.8,3,3,1729,COMPLETE
91,0.8829434760317867,2025-09-12 16:41:41.603696,2025-09-12 16:42:34.287126,0 days 00:00:52.683430,False,balanced,entropy,,0.8,3,3,1693,COMPLETE
92,0.8829498846449628,2025-09-12 16:41:45.615730,2025-09-12 16:42:41.251815,0 days 00:00:55.636085,False,balanced,entropy,,0.8,3,3,1712,COMPLETE
93,0.8464976928992566,2025-09-12 16:42:07.729728,2025-09-12 16:42:19.149293,0 days 00:00:11.419565,False,balanced,entropy,,0.8,9,3,1797,PRUNED
94,0.8478595231991797,2025-09-12 16:42:13.189265,2025-09-12 16:42:24.912830,0 days 00:00:11.723565,False,balanced,entropy,,0.8,8,3,1830,PRUNED
95,0.8852217380158933,2025-09-12 16:42:19.611218,2025-09-12 16:42:58.157810,0 days 00:00:38.546592,False,balanced,entropy,,0.8,2,4,1439,COMPLETE
96,0.885263394001538,2025-09-12 16:42:25.454454,2025-09-12 16:43:01.402574,0 days 00:00:35.948120,False,balanced,entropy,,0.8,2,4,1448,COMPLETE
97,0.8852473724685979,2025-09-12 16:42:26.996535,2025-09-12 16:43:03.554562,0 days 00:00:36.558027,False,balanced,entropy,,0.8,2,4,1424,COMPLETE
98,0.8495578056908484,2025-09-12 16:42:34.452866,2025-09-12 16:42:43.505599,0 days 00:00:09.052733,False,balanced,entropy,,0.8,2,24,1430,PRUNED
99,0.8852345552422456,2025-09-12 16:42:41.641588,2025-09-12 16:43:05.610616,0 days 00:00:23.969028,False,balanced,entropy,,0.8,2,4,1450,COMPLETE
